vdo,dwn,img,title,dur
https://chiggywiggy.com/33146/beautiful-bangladeshi-tiktoker-fariha-showing-her-boobs-and-tight-pussy-on-video-call-bengali-audio-clips-7-of-8/,https://chiggywiggy.com/vfile/33146/33109/1/290ff87537cb0a8666bb/1695124865/mp4/33146_720p.mp4,https://chiggywiggy.com/media/videos/tmb/000/033/146/1.jpg,beautiful bangladeshi tiktoker fariha showing her boobs and tight pussy on video call bengali audio clips 7 of 8,2:11
https://chiggywiggy.com/33035/desi-cute-girlfriend-brown-nipples-and-big-boobs-pressed-by-bf-from-behind-in-hotel-room/,https://chiggywiggy.com/vfile/33035/32971/1/a19a7b3459f94fe5bf4d/1695124865/mp4/33035_1080p.mp4,https://chiggywiggy.com/media/videos/tmb/000/033/035/6.jpg,desi cute girlfriend brown nipples and big boobs pressed by bf from behind in hotel room,1:07
https://chiggywiggy.com/33848/onlyfans-mollyella-onlyfans-premium-sex-video-cute-girl-riding-bf-xodk-in-cowgirl-and-reverse-cowgirl-for-fans/,https://chiggywiggy.com/vfile/33848/34013/2/4a5ce19b07903ccb9f73/1695124865/mp4/33848_1080p.mp4,https://chiggywiggy.com/media/videos/tmb/000/033/848/2.jpg,onlyfans mollyella onlyfans premium sex video cute girl riding bf xodk in cowgirl and reverse cowgirl for fans,11:18
https://chiggywiggy.com/32022/indian-sexy-bhabhi-in-nighty-teasing-her-lover-on-video-call-showing-her-big-boobs-and-her-tight-pussy/,https://chiggywiggy.com/vfile/32022/31676/2/627acc5f19b500c2c0fc/1695124865/mp4/32022_1080p.mp4,https://chiggywiggy.com/media/videos/tmb/000/032/022/1.jpg,indian sexy bhabhi in nighty teasing her lover on video call showing her big boobs and her tight pussy,2:02
https://chiggywiggy.com/32740/indian-girl-setup-video-cam-while-fucking-with-her-lover/,https://chiggywiggy.com/vfile/32740/32612/2/ef390012c29aa3a974f1/1695124865/mp4/32740_720p.mp4,https://chiggywiggy.com/media/videos/tmb/000/032/740/1.jpg,indian girl setup video cam while fucking with her lover,2:54
https://chiggywiggy.com/32423/mona-69-part-2-2023-s01-e03-hindi-web-series-full-uncut-video/,https://chiggywiggy.com/vfile/32423/32196/2/c2077b0841c50306b3c2/1695124865/mp4/32423_720p.mp4,https://chiggywiggy.com/media/videos/tmb/000/032/423/1.jpg,mona 69 part 2 2023 s01 e03 hindi web series full uncut video,23:51
https://chiggywiggy.com/32229/cute-girlfriend-showing-her-naked-body-and-rubbing-her-tight-pussy-on-video-call-1-of-2/,https://chiggywiggy.com/vfile/33667/33788/1/6c2b6bdf2b094fc81a6a/1695124775/mp4/33667_1080p.mp4,https://chiggywiggy.com/media/videos/tmb/000/032/229/6.jpg,cute girlfriend showing her naked body and rubbing her tight pussy on video call 1 of 2,2:50
https://chiggywiggy.com/33540/old-viral-video-mms-khasam-khate-khate-pura-video-bhi-record-kar-liya-aur-leak-bhi-kar-diya-cute-girl-kissing-boobs-show/,https://chiggywiggy.com/vfile/33667/33788/1/6c2b6bdf2b094fc81a6a/1695124775/mp4/33667_1080p.mp4,https://chiggywiggy.com/media/videos/tmb/000/033/540/1.jpg,old viral video mms khasam khate khate pura video bhi record kar liya aur leak bhi kar diya cute girl kissing boobs show,4:37
https://chiggywiggy.com/32530/beautiful-indian-skinny-girl-playing-with-cock-and-getting-cumshot-on-face-while-taking-big-cock-in-her-tight-pussy-saying-help-karo-7-of-10/,https://chiggywiggy.com/vfile/32530/32361/2/f2ec8dc1028888afa419/1695124865/mp4/32530_720p.mp4,https://chiggywiggy.com/media/videos/tmb/000/032/530/1.jpg,beautiful indian skinny girl playing with cock and getting cumshot on face while taking big cock in her tight pussy saying help karo 7 of 10,0:32
https://chiggywiggy.com/33342/shadishuda-couple-ne-sex-mms-bahttps://chiggywiggy.com/vfile/33667/33788/1/6c2b6bdf2b094fc81a6a/1695124775/mp4/33667_1080p.mp4e-ki-fantasy-me-apna-video-banaya-jo-husband-ke-dosto-se-galti-se-leak-ho-gaya/,https://chiggywiggy.com/vfile/33342/33352/1/f010d503762c6ce798f7/1695124866/mp4/33342_720p.mp4,https://chiggywiggy.com/media/videos/tmb/000/033/342/1.jpg,shadishuda couple ne sex mms bahttps:,9:25
https://chiggywiggy.com/33239/tango-live-sexy-girl-dancing-and-showing-her-big-boobs-full-stripping-video-with-face-viral-video-mms/,https://chiggywiggy.com/vfile/33239/33224/2/16b0c953c02b54d1d968/1695124866/mp4/33239_720p.mp4,https://chiggywiggy.com/media/videos/tmb/000/033/239/8.jpg,tango live sexy girl dancing and showing her big boobs full stripping video with face viral video mms,4:02
https://chiggywiggy.com/32830/drive-short-film-full-uncut-porn-video-download/,https://chiggywiggy.com/vfile/32830/32708/2/ef2a1a3da226e5d43865/1695124866/mp4/32830_720p.mp4,https://chiggywiggy.com/media/videos/tmb/000/032/830/10.jpg,drive short film full uncut porn video download,28:43
https://chiggywiggy.com/33428/desichuttar/,https://chiggywiggy.com/vfile/33428/33474/1/efa014294496e02bb396/1695124866/mp4/33428_1080p.mp4,https://chiggywiggy.com/media/videos/tmb/000/033/428/1.jpg,desichuttar,0:42
https://chiggywiggy.com/32130/club-ke-bathroom-me-chudai-model-jaisi-sexy-body-wali-ladki-ka-stranger-ke-sath-quick-sex/,https://chiggywiggy.com/vfile/33667/33788/1/6c2b6bdf2b094fc81a6a/1695124775/mp4/33667_1080p.mp4,https://chiggywiggy.com/media/videos/tmb/000/032/130/9.jpg,club ke bathroom me chudai model jaisi sexy body wali ladki ka stranger ke sath quick sex,5:28
https://chiggywiggy.com/33755/cheating-bhabhis-chudai-videos-with-lover-compilation/,https://chiggywiggy.com/vfile/33755/33895/1/8d45f41b45ad2c1c4f1c/1695124867/mp4/33755_480p.mp4,https://chiggywiggy.com/media/videos/tmb/000/033/755/7.jpg,cheating bhabhis chudai videos with lover compilation,8:54
https://chiggywiggy.com/32324/teen-girl-big-cock-blowjob-and-self-recording-her-video/,https://chiggywiggy.com/vfile/32324/32067/2/4da660e13101d5e88cb0/1695124867/mp4/32324_1080p.mp4,https://chiggywiggy.com/media/videos/tmb/000/032/324/1.jpg,teen girl big cock blowjob and self recording her video,0:34
https://chiggywiggy.com/32021/dehati-bhabhi-ki-tight-chut-me-mera-lund/,https://chiggywiggy.com/vfile/32021/31674/1/0eb90de528b10478d864/1695124867/mp4/32021_1080p.mp4,https://chiggywiggy.com/media/videos/tmb/000/032/021/7.jpg,dehati bhabhi ki tight chut me mera lund,1:19
https://chiggywiggy.com/32422/mona-69-part-2-2023-s01-e04-hindi-web-series-full-uncut-video/,https://chiggywiggy.com/vfile/32422/32195/2/f81fe205920878fd4256/1695124868/mp4/32422_720p.mp4,https://chiggywiggy.com/media/videos/tmb/000/032/422/1.jpg,mona 69 part 2 2023 s01 e04 hindi web series full uncut video,25:09
https://chiggywiggy.com/33145/beautiful-bangladeshi-tiktoker-fariha-showing-her-boobs-and-tight-pussy-on-video-call-bengali-audio-clips-1-of-8/,https://chiggywiggy.com/vfile/33145/33108/2/2a63353817495d0726bf/1695124868/mp4/33145_720p.mp4,https://chiggywiggy.com/media/videos/tmb/000/033/145/1.jpg,beautiful bangladeshi tiktoker fariha showing her boobs and tight pussy on video call bengali audio clips 1 of 8,3:13
https://chiggywiggy.com/33849/desi-village-bhabhi-using-towel-and-wearing-clothes-in-front-of-camera-after-nude-bathing-viral-mms/,https://chiggywiggy.com/vfile/33849/34015/1/c861538792e95419feb1/1695124868/mp4/33849_1080p.mp4,https://chiggywiggy.com/media/videos/tmb/000/033/849/3.jpg,desi village bhabhi using towel and wearing clothes in front of camera after nude bathing viral mms,1:00
https://chiggywiggy.com/32739/desi-couple-ka-bathroom-me-romance-gile-floor-par-latake-bhabhi-ki-chudai/,https://chiggywiggy.com/vfile/32739/32611/1/767ef33ec59bc92d2aa7/1695124868/mp4/32739_720p.mp4,https://chiggywiggy.com/media/videos/tmb/000/032/739/9.jpg,desi couple ka bathroom me romance gile floor par latake bhabhi ki chudai,8:03
https://chiggywiggy.com/32633/pakistani-cam-couple-homemade-sex-video-rubbing-wife-tight-pussy-and-fucking-her-in-doggystyle/,https://chiggywiggy.com/vfile/33667/33788/1/6c2b6bdf2b094fc81a6a/1695124775/mp4/33667_1080p.mp4,https://chiggywiggy.com/media/videos/tmb/000/032/633/1.jpg,pakistani cam couple homemade sex video rubbing wife tight pussy and fucking her in doggystyle,8:26
https://chiggywiggy.com/33034/cute-chubby-girl-with-big-boobs-and-ass-dress-changing-video/,https://chiggywiggy.com/vfile/33034/32969/2/4bd09fc76eda56918ffa/1695124868/mp4/33034_1080p.mp4,https://chiggywiggy.com/media/videos/tmb/000/033/034/1.jpg,cute chubby girl with big boobs and ass dress changing video,2:57
https://chiggywiggy.com/33427/desichuttar/,https://chiggywiggy.com/vfile/33427/33472/2/65b86742599e6de87b94/1695124869/mp4/33427_720p.mp4,https://chiggywiggy.com/media/videos/tmb/000/033/427/1.jpg,desichuttar,0:13
https://chiggywiggy.com/32125/hot-stepmom-impressed-with-her-young-step-son-and-let-him-fuck-her-all-night-pristine-edge/,https://chiggywiggy.com/vfile/32125/31808/2/cfb577c8bd1484e663fc/1695124870/mp4/32125_720p.mp4,https://chiggywiggy.com/media/videos/tmb/000/032/125/7.jpg,hot stepmom impressed with her young step son and let him fuck her all night pristine edge,22:13
https://chiggywiggy.com/33538/young-couple-kissing-romance-and-boob-sucking-part-3/,https://chiggywiggy.com/vfile/33538/33614/1/d78b93328079533466dc/1695124870/mp4/33538_1080p.mp4,https://chiggywiggy.com/media/videos/tmb/000/033/538/1.jpg,young couple kissing romance and boob sucking part 3,2:36
https://chiggywiggy.com/33341/college-girl-ko-1000rs-dekhar-chudwaya-uncle-ne-land-chuskar-boobs-hilate-mast-uchal-rahi-hai/,https://chiggywiggy.com/vfile/33341/33351/2/bc1a1b69d81b4d68aa21/1695124870/mp4/33341_720p.mp4,https://chiggywiggy.com/media/videos/tmb/000/033/341/1.jpg,college girl ko 1000rs dekhar chudwaya uncle ne land chuskar boobs hilate mast uchal rahi hai,0:52
https://chiggywiggy.com/32228/desi-cute-girlfriend-sucking-cock-and-rubbing-cock-on-her-tight-pussy-moaning-loud/,https://chiggywiggy.com/vfile/33667/33788/1/6c2b6bdf2b094fc81a6a/1695124775/mp4/33667_1080p.mp4,https://chiggywiggy.com/media/videos/tmb/000/032/228/5.jpg,desi cute girlfriend sucking cock and rubbing cock on her tight pussy moaning loud,1:55
https://chiggywiggy.com/32829/sexy-figure-wali-prostitute-ko-mast-jump-karaya-lund-par-5000rs-pura-wasool-chudai-1-of-2/,https://chiggywiggy.com/vfile/32829/32707/2/f3b0558a563f856a09dc/1695124870/mp4/32829_720p.mp4,https://chiggywiggy.com/media/videos/tmb/000/032/829/8.jpg,sexy figure wali prostitute ko mast jump karaya lund par 5000rs pura wasool chudai 1 of 2,2:20
https://chiggywiggy.com/32529/beautiful-indian-skinny-girl-playing-with-cock-and-getting-cumshot-on-face-while-taking-big-cock-in-her-tight-pussy-saying-help-karo-2-of-10/,https://chiggywiggy.com/vfile/32529/32360/1/d6f3e86e03b7d613c11d/1695124871/mp4/32529_720p.mp4,https://chiggywiggy.com/media/videos/tmb/000/032/529/1.jpg,beautiful indian skinny girl playing with cock and getting cumshot on face while taking big cock in her tight pussy saying help karo 2 of 10,1:00
https://chiggywiggy.com/33743/desi-girl-showing-pussy-and-fingering/,https://chiggywiggy.com/vfile/33743/33878/1/a4e7b8fc56a032a520ae/1695124870/mp4/33743_480p.mp4,https://chiggywiggy.com/media/videos/tmb/000/033/743/1.jpg,desi girl showing pussy and fingering,1:47
https://chiggywiggy.com/32020/indian-merged-sexy-video-of-punjabi-chitkara-university-hottie-in-hostel-room/,https://chiggywiggy.com/vfile/32020/31672/2/303bcb82c44c60c36d7e/1695124871/mp4/32020_1080p.mp4,https://chiggywiggy.com/media/videos/tmb/000/032/020/7.jpg,indian merged sexy video of punjabi chitkara university hottie in hostel room,1:02
https://chiggywiggy.com/32323/pados-ki-aunty-ne-ghar-bhulaya-pata-nahi-kyu-baad-me-ye-hua-sexy-maal-aunty/,https://chiggywiggy.com/vfile/32323/32065/2/580e7910ece9aab85be5/1695124871/mp4/32323_1080p.mp4,https://chiggywiggy.com/media/videos/tmb/000/032/323/8.jpg,pados ki aunty ne ghar bhulaya pata nahi kyu baad me ye hua sexy maal aunty,18:41
https://chiggywiggy.com/32421/mona-69-2023-s01-e01-hindi-web-series-full-uncut-video/,https://chiggywiggy.com/vfile/32421/32194/2/e63ad358f5059655dd8f/1695124871/mp4/32421_720p.mp4,https://chiggywiggy.com/media/videos/tmb/000/032/421/1.jpg,mona 69 2023 s01 e01 hindi web series full uncut video,22:13
https://chiggywiggy.com/33643/moti-gandwali-padosan-bhabhi-ki-hotel-marte-video-recording-3-of-4/,https://chiggywiggy.com/vfile/33643/33763/1/62429216c1ca2a08d971/1695124871/mp4/33643_1080p.mp4,https://chiggywiggy.com/media/videos/tmb/000/033/643/1.jpg,moti gandwali padosan bhabhi ki hotel marte video recording 3 of 4,1:32
https://chiggywiggy.com/33143/amateur-hot-desi-village-couple-fucking-with-real-romance-indian-sex-video/,https://chiggywiggy.com/vfile/33143/33106/2/6dba29fa827016a55090/1695124872/mp4/33143_1080p.mp4,https://chiggywiggy.com/media/videos/tmb/000/033/143/9.jpg,amateur hot desi village couple fucking with real romance indian sex video,1:41
https://chiggywiggy.com/33425/desichuttar/,https://chiggywiggy.com/vfile/33425/33470/2/a049b1743a83ef018a90/1695124873/mp4/33425_1080p.mp4,https://chiggywiggy.com/media/videos/tmb/000/033/425/1.jpg,desichuttar,0:39
https://chiggywiggy.com/33537/girlfriend-rubbing-boyfriends-cock-with-legs/,https://chiggywiggy.com/vfile/33537/33610/2/25006af0f4cf666a17bb/1695124873/mp4/33537_720p.mp4,https://chiggywiggy.com/media/videos/tmb/000/033/537/1.jpg,girlfriend rubbing boyfriends cock with legs,3:47
https://chiggywiggy.com/32631/sanjna-sucking-my-black-cock-mms/,https://chiggywiggy.com/vfile/32631/32481/2/9dad6588710f71dee6fa/1695124873/mp4/32631_480p.mp4,https://chiggywiggy.com/media/videos/tmb/000/032/631/1.jpg,sanjna sucking my black cock mms,1:58
https://chiggywiggy.com/33847/raat-me-sone-se-pahle-biwi-ki-tight-choot-ki-chudai-indian-porn-video-2-of-2/,https://chiggywiggy.com/vfile/33847/34011/1/0eb0b7c361500ec5d8df/1695124873/mp4/33847_1080p.mp4,https://chiggywiggy.com/media/videos/tmb/000/033/847/1.jpg,raat me sone se pahle biwi ki tight choot ki chudai indian porn video 2 of 2,1:02
https://chiggywiggy.com/32738/nri-punjabi-girl-sucking-big-cock-while-bf-busy-in-recording-video-2-of-2/,https://chiggywiggy.com/vfile/32738/32610/2/67359757edd7ebb8a58a/1695124874/mp4/32738_720p.mp4,https://chiggywiggy.com/media/videos/tmb/000/032/738/1.jpg,nri punjabi girl sucking big cock while bf busy in recording video 2 of 2,1:31
https://chiggywiggy.com/32123/sexy-paytm-girl-ne-dance-karte-pure-kapde-utare-aur-apne-stiff-big-boobs-ko-dabane-lagi-bed-par-lete/,https://chiggywiggy.com/vfile/32123/31806/2/cfbcc83dad7cfbe7aa5f/1695124874/mp4/32123_720p.mp4,https://chiggywiggy.com/media/videos/tmb/000/032/123/6.jpg,sexy paytm girl ne dance karte pure kapde utare aur apne stiff big boobs ko dabane lagi bed par lete,4:13
https://chiggywiggy.com/33033/sexy-punjabi-bhabhi-trying-neighbour-college-boys-dick-big-boobs-wife-affair-sex/,https://chiggywiggy.com/vfile/33033/32967/1/4945451e22bec810730a/1695124874/mp4/33033_480p.mp4,https://chiggywiggy.com/media/videos/tmb/000/033/033/8.jpg,sexy punjabi bhabhi trying neighbour college boys dick big boobs wife affair sex,1:13
https://chiggywiggy.com/33340/gay-crossdresser-chakke-friend-ke-sath-chudai-dosto-ke-sath-khade-khade-piche-se-pela/,https://chiggywiggy.com/vfile/33340/33350/1/e13b7625fdf2e227b577/1695124875/mp4/33340_720p.mp4,https://chiggywiggy.com/media/videos/tmb/000/033/340/1.jpg,gay crossdresser chakke friend ke sath chudai dosto ke sath khade khade piche se pela,1:41
https://chiggywiggy.com/33754/sexy-milf-trying-her-first-gangbang-and-saying-go-fucking-me-hard-baby-while-sucking-dick/,https://chiggywiggy.com/vfile/33754/33894/2/f8ace79ed6f089106a47/1695124875/mp4/33754_480p.mp4,https://chiggywiggy.com/media/videos/tmb/000/033/754/1.jpg,sexy milf trying her first gangbang and saying go fucking me hard baby while sucking dick,0:29
https://chiggywiggy.com/32933/girlfriend-ki-first-time-tel-lagakar-gand-mari-bf-ne/,https://chiggywiggy.com/vfile/33667/33788/1/6c2b6bdf2b094fc81a6a/1695124775/mp4/33667_1080p.mp4,https://chiggywiggy.com/media/videos/tmb/000/032/933/1.jpg,girlfriend ki first time tel lagakar gand mari bf ne,10:41
https://chiggywiggy.com/32019/kareena-chopra-live-showing-big-ass-and-her-small-boobs-on-live-stripchat/,https://chiggywiggy.com/vfile/32019/31670/1/bee0abb5def4dfdb4fa8/1695124875/mp4/32019_1080p.mp4,https://chiggywiggy.com/media/videos/tmb/000/032/019/4.jpg,kareena chopra live showing big ass and her small boobs on live stripchat,6:08
https://chiggywiggy.com/32528/chuddakad-aunty-seduced-young-boy-for-sex-riding-and-playing-with-big-cock/,https://chiggywiggy.com/vfile/32528/32359/2/a66f1c457201092df1d0/1695124875/mp4/32528_1080p.mp4,https://chiggywiggy.com/media/videos/tmb/000/032/528/3.jpg,chuddakad aunty seduced young boy for sex riding and playing with big cock,4:24
https://chiggywiggy.com/32828/desi-couple-homemade-sex-video-pati-itna-tej-chod-raha-hai-par-patni-ke-chehre-par-koi-expression-nahi/,https://chiggywiggy.com/vfile/32828/32706/1/e0bc494bf6f316c6226e/1695124876/mp4/32828_720p.mp4,https://chiggywiggy.com/media/videos/tmb/000/032/828/8.jpg,desi couple homemade sex video pati itna tej chod raha hai par patni ke chehre par koi expression nahi,3:38
https://chiggywiggy.com/32225/lockdown-me-bhabhi-devar-ka-affair-me-blowjob-and-katiya-chudai-video-leaked-2-of-6/,https://chiggywiggy.com/vfile/32225/31942/2/2d85a5d69212f8f6c027/1695124876/mp4/32225_1080p.mp4,https://chiggywiggy.com/media/videos/tmb/000/032/225/1.jpg,lockdown me bhabhi devar ka affair me blowjob and katiya chudai video leaked 2 of 6,2:19
https://chiggywiggy.com/33032/hotel-room-me-randi-ko-gand-pakad-ke-choda-customer-ne/,https://chiggywiggy.com/vfile/33032/32966/2/9d67993742ce7b04e2f9/1695124876/mp4/33032_480p.mp4,https://chiggywiggy.com/media/videos/tmb/000/033/032/1.jpg,hotel room me randi ko gand pakad ke choda customer ne,1:53
https://chiggywiggy.com/33642/is-ladki-ki-dikkat-kya-hai-mode-boobs-par-clip-lagakar-roughy-chut-rub-kar-rahi-hai-2-of-2/,https://chiggywiggy.com/vfile/33642/33761/2/0a66101cbea029d244fe/1695124876/mp4/33642_1080p.mp4,https://chiggywiggy.com/media/videos/tmb/000/033/642/1.jpg,is ladki ki dikkat kya hai mode boobs par clip lagakar roughy chut rub kar rahi hai 2 of 2,2:16
https://chiggywiggy.com/32419/tere-jaisa-yaar-kaha-part-02-2023-s01-e07-hindi-web-series-full-uncut-video/,https://chiggywiggy.com/vfile/32419/32190/2/a1a480c26ef3f3f67b2e/1695124876/mp4/32419_720p.mp4,https://chiggywiggy.com/media/videos/tmb/000/032/419/1.jpg,tere jaisa yaar kaha part 02 2023 s01 e07 hindi web series full uncut video,24:46
https://chiggywiggy.com/33445/doodh-se-bhare-big-boobs-ko-dabakar-doodh-land-par-gira-rahi-hai-sexy-bhabhi/,https://chiggywiggy.com/vfile/33445/33496/2/0b6995f19bce4a19449a/1695124876/mp4/33445_720p.mp4,https://chiggywiggy.com/media/videos/tmb/000/033/445/1.jpg,doodh se bhare big boobs ko dabakar doodh land par gira rahi hai sexy bhabhi,0:31
https://chiggywiggy.com/32122/online-pati-ramya-ki-ghar-bhulakar-chudai-tight-chut-par-lund-ragad-ke-under-gusaya/,https://chiggywiggy.com/vfile/32122/31805/1/f746d8a29d46d98c6797/1695124876/mp4/32122_720p.mp4,https://chiggywiggy.com/media/videos/tmb/000/032/122/2.jpg,online pati ramya ki ghar bhulakar chudai tight chut par lund ragad ke under gusaya,2:04
https://chiggywiggy.com/32737/horny-cheating-wife-sucking-big-cock-and-balls-of-lover/,https://chiggywiggy.com/vfile/32737/32609/1/863fb487461d810b494f/1695124876/mp4/32737_720p.mp4,https://chiggywiggy.com/media/videos/tmb/000/032/737/1.jpg,horny cheating wife sucking big cock and balls of lover,1:22
https://chiggywiggy.com/32629/nikki-tamboli-sex-mms-video-mms/,https://chiggywiggy.com/vfile/33667/33788/1/6c2b6bdf2b094fc81a6a/1695124775/mp4/33667_1080p.mp4,https://chiggywiggy.com/media/videos/tmb/000/032/629/1.jpg,nikki tamboli sex mms video mms,1:16
https://chiggywiggy.com/32322/kya-naam-hai-is-ladki-ka-kitna-mast-face-aur-figure-hai-sexy-girl-fucked-on-sofa/,https://chiggywiggy.com/vfile/32322/32063/2/1d168d12e0e441cb528b/1695124876/mp4/32322_1080p.mp4,https://chiggywiggy.com/media/videos/tmb/000/032/322/1.jpg,kya naam hai is ladki ka kitna mast face aur figure hai sexy girl fucked on sofa,8:00
https://chiggywiggy.com/33846/desi-rich-girl-after-party-sucking-bf-cock-and-licking-his-balls/,https://chiggywiggy.com/vfile/33846/34009/2/d02b02f4da4a10b06790/1695124877/mp4/33846_1080p.mp4,https://chiggywiggy.com/media/videos/tmb/000/033/846/1.jpg,desi rich girl after party sucking bf cock and licking his balls,1:13
https://chiggywiggy.com/33142/south-indian-beautiful-bhabhi-with-big-boobs-romance-with-lover-cheating-wife-sex-video/,https://chiggywiggy.com/vfile/33142/33104/1/a020449d836432656e2b/1695124877/mp4/33142_1080p.mp4,https://chiggywiggy.com/media/videos/tmb/000/033/142/1.jpg,south indian beautiful bhabhi with big boobs romance with lover cheating wife sex video,2:51
https://chiggywiggy.com/33339/videshi-couple-very-rough-sex-kitni-tej-tej-land-par-uchal-rahi-hai-girlfriend/,https://chiggywiggy.com/vfile/33339/33349/2/5ccd0b54ff80d40a896f/1695124877/mp4/33339_720p.mp4,https://chiggywiggy.com/media/videos/tmb/000/033/339/1.jpg,videshi couple very rough sex kitni tej tej land par uchal rahi hai girlfriend,2:51
https://chiggywiggy.com/32932/biwi-ko-land-par-uchalkar-phir-ghodi-banaya-aur-pura-maal-gand-par-gira-diya/,https://chiggywiggy.com/vfile/33667/33788/1/6c2b6bdf2b094fc81a6a/1695124775/mp4/33667_1080p.mp4,https://chiggywiggy.com/media/videos/tmb/000/032/932/1.jpg,biwi ko land par uchalkar phir ghodi banaya aur pura maal gand par gira diya,1:33
https://chiggywiggy.com/33536/biwi-ke-mote-boobs-par-love-bite-aur-hard-chudai-karte-full-video/,https://chiggywiggy.com/vfile/33536/33609/1/e33515d4c57f16197e37/1695124877/mp4/33536_720p.mp4,https://chiggywiggy.com/media/videos/tmb/000/033/536/1.jpg,biwi ke mote boobs par love bite aur hard chudai karte full video,8:01
https://chiggywiggy.com/33753/asian-men-party-sex-after-promotion-fucking-roughly-sexy-bitch-shy-sucking-another-man-cock/,https://chiggywiggy.com/vfile/33753/33893/1/9b80116f98e5642daffd/1695124877/mp4/33753_480p.mp4,https://chiggywiggy.com/media/videos/tmb/000/033/753/9.jpg,asian men party sex after promotion fucking roughly sexy bitch shy sucking another man cock,2:00
https://chiggywiggy.com/31920/beautiful-aunty-aur-uncle-ki-chudai-sath-english-gaane-sunte-pornstars-jaise-video-banaya/,https://chiggywiggy.com/vfile/31920/31546/2/18d8827502c53db049ce/1695124877/mp4/31920_720p.mp4,https://chiggywiggy.com/media/videos/tmb/000/031/920/10.jpg,beautiful aunty aur uncle ki chudai sath english gaane sunte pornstars jaise video banaya,9:45
https://chiggywiggy.com/32018/pados-ke-logo-tak-aawaj-na-pahuche-isliye-isharo-isharo-me-baatekarte-chudai-chal-rahi-hai/,https://chiggywiggy.com/vfile/32018/31668/2/0ed5906aa2ca23e46262/1695124878/mp4/32018_1080p.mp4,https://chiggywiggy.com/media/videos/tmb/000/032/018/6.jpg,pados ke logo tak aawaj na pahuche isliye isharo isharo me baatekarte chudai chal rahi hai,1:22
https://chiggywiggy.com/32527/sexy-dehati-aunty-giving-bj-and-riding-young-guy-cock-while-he-recording-it-2-of-2/,https://chiggywiggy.com/vfile/32527/32356/1/051725e46b41303b48b2/1695124878/mp4/32527_1080p.mp4,https://chiggywiggy.com/media/videos/tmb/000/032/527/5.jpg,sexy dehati aunty giving bj and riding young guy cock while he recording it 2 of 2,0:56
https://chiggywiggy.com/32826/ye-kaisi-jagah-hai-maidan-ke-khule-me-itna-mast-couple-ka-chudai-chal-raha-hai/,https://chiggywiggy.com/vfile/32826/32704/1/6aa31316f251acf48e41/1695124879/mp4/32826_720p.mp4,https://chiggywiggy.com/media/videos/tmb/000/032/826/2.jpg,ye kaisi jagah hai maidan ke khule me itna mast couple ka chudai chal raha hai,2:10
https://chiggywiggy.com/33641/moti-gandwali-padosan-bhabhi-ki-hotel-marte-video-recording-1-of-4/,https://chiggywiggy.com/vfile/33641/33759/1/dd2907bf086e31caa227/1695124879/mp4/33641_1080p.mp4,https://chiggywiggy.com/media/videos/tmb/000/033/641/1.jpg,moti gandwali padosan bhabhi ki hotel marte video recording 1 of 4,0:46
https://chiggywiggy.com/33031/newly-wed-couple-sex-video/,https://chiggywiggy.com/vfile/33031/32965/1/874ab58031e1d1a9701f/1695124879/mp4/33031_480p.mp4,https://chiggywiggy.com/media/videos/tmb/000/033/031/3.jpg,newly wed couple sex video,1:31
https://chiggywiggy.com/32418/desi-village-bhabhi-cute-expressions-when-her-lover-inserts-his-cock-in-hairy-pussy/,https://chiggywiggy.com/vfile/32418/32189/1/5b737722e91b62234fbc/1695124879/mp4/32418_720p.mp4,https://chiggywiggy.com/media/videos/tmb/000/032/418/9.jpg,desi village bhabhi cute expressions when her lover inserts his cock in hairy pussy,1:06
https://chiggywiggy.com/33444/ruks-khadagale-ka-do-ladko-ke-sath-threesome-live-viral-video-mms-boobs-squeeze-and-blowjob/,https://chiggywiggy.com/vfile/33444/33495/1/616f89ba6774a6aa9a7f/1695124879/mp4/33444_720p.mp4,https://chiggywiggy.com/media/videos/tmb/000/033/444/3.jpg,ruks khadagale ka do ladko ke sath threesome live viral video mms boobs squeeze and blowjob,28:32
https://chiggywiggy.com/32121/bhabhi-checking-her-big-boobs-and-pressing-her-nipples/,https://chiggywiggy.com/vfile/32121/31804/2/d8ed2658cef5f4eb4cdb/1695124879/mp4/32121_720p.mp4,https://chiggywiggy.com/media/videos/tmb/000/032/121/1.jpg,bhabhi checking her big boobs and pressing her nipples,0:10
https://chiggywiggy.com/32321/badi-gand-wali-mast-bahan-ki-chudai-bhaiya-ho-gaya-kya-bahut-garmi-lag-rahi-hai/,https://chiggywiggy.com/vfile/32321/32061/1/9625bc559bac085dc9b7/1695124880/mp4/32321_480p.mp4,https://chiggywiggy.com/media/videos/tmb/000/032/321/1.jpg,badi gand wali mast bahan ki chudai bhaiya ho gaya kya bahut garmi lag rahi hai,1:11
https://chiggywiggy.com/32931/bade-dudu-wali-girlfriend-ki-hotel-me-tang-utake-ke-choda-aur-muh-me-land-diya/,https://chiggywiggy.com/vfile/33667/33788/1/6c2b6bdf2b094fc81a6a/1695124775/mp4/33667_1080p.mp4,https://chiggywiggy.com/media/videos/tmb/000/032/931/3.jpg,bade dudu wali girlfriend ki hotel me tang utake ke choda aur muh me land diya,6:30
