vdo,dwn,img,title,dur
https://chiggywiggy.com/32281/sexy-chubby-girl-sanchita-gavebblowjob-getting-fucked-in-missionary-and-doggy-with-boyfriend/,https://chiggywiggy.com/vfile/32281/32012/1/96c944fbb83ed70ca154/1695125032/mp4/32281_1080p.mp4,https://chiggywiggy.com/media/videos/tmb/000/032/281/6.jpg,sexy chubby girl sanchita gavebblowjob getting fucked in missionary and doggy with boyfriend,7:28
https://chiggywiggy.com/33190/indian-beautiful-and-cute-desi-aunty-first-time-hard-fucking/,https://chiggywiggy.com/vfile/33190/33158/1/b2a7453e99d5c7e70123/1695125032/mp4/33190_720p.mp4,https://chiggywiggy.com/media/videos/tmb/000/033/190/6.jpg,indian beautiful and cute desi aunty first time hard fucking,3:03
https://chiggywiggy.com/32990/sexy-model-jaisi-ladki-ka-boobs-and-pussy-show-premium-live-cam-par-viral-video-halfgirlfriend121/,https://chiggywiggy.com/vfile/32990/32914/2/5afae40863e43e2ccad3/1695125032/mp4/32990_720p.mp4,https://chiggywiggy.com/media/videos/tmb/000/032/990/2.jpg,sexy model jaisi ladki ka boobs and pussy show premium live cam par viral video halfgirlfriend121,12:05
https://chiggywiggy.com/33699/india-s-most-in-demand-college-student-shows-tits-and-pussy-indian-porn-video/,https://chiggywiggy.com/vfile/33667/33788/1/6c2b6bdf2b094fc81a6a/1695124775/mp4/33667_1080p.mp4,https://chiggywiggy.com/media/videos/tmb/000/033/699/1.jpg,india s most in demand college student shows tits and pussy indian porn video,7:34
https://chiggywiggy.com/32693/latika-hot-doggy-fucking-and-saying-or-tej-chod-na-behnchod-indian-xxx-video/,https://chiggywiggy.com/vfile/32693/32549/2/bdce648f35c7c3847bb7/1695125033/mp4/32693_720p.mp4,https://chiggywiggy.com/media/videos/tmb/000/032/693/1.jpg,latika hot doggy fucking and saying or tej chod na behnchod indian xxx video,2:17
https://chiggywiggy.com/33393/sexy-lily-multiple-orgasms-while-getting-fucked-indian-sexy-babe/,https://chiggywiggy.com/vfile/33393/33414/1/a27f8926a4d41b563abc/1695125033/mp4/33393_1080p.mp4,https://chiggywiggy.com/media/videos/tmb/000/033/393/1.jpg,sexy lily multiple orgasms while getting fucked indian sexy babe,0:30
https://chiggywiggy.com/32884/mehangi-randi-ko-ghar-bhulakar-do-dosto-ne-milkar-choda-desi-threesome-with-prostitute/,https://chiggywiggy.com/vfile/32884/32780/2/f1b41a9544985286191c/1695125033/mp4/32884_720p.mp4,https://chiggywiggy.com/media/videos/tmb/000/032/884/3.jpg,mehangi randi ko ghar bhulakar do dosto ne milkar choda desi threesome with prostitute,25:13
https://chiggywiggy.com/33294/tamil-baby-enjoy-with-her-ex-boy-friend-enjoy-penis-sucking-and-painful-fucking-standing-doggy-style-fucking-hindi/,https://chiggywiggy.com/vfile/33294/33289/1/9b52f8188df2f32020cb/1695125034/mp4/33294_720p.mp4,https://chiggywiggy.com/media/videos/tmb/000/033/294/7.jpg,tamil baby enjoy with her ex boy friend enjoy penis sucking and painful fucking standing doggy style fucking hindi,6:14
https://chiggywiggy.com/31971/college-ki-innocent-ladki-ko-patakar-chudai-karte-video-banaya-tapori-ladke-ne/,https://chiggywiggy.com/vfile/33667/33788/1/6c2b6bdf2b094fc81a6a/1695124775/mp4/33667_1080p.mp4,https://chiggywiggy.com/media/videos/tmb/000/031/971/8.jpg,college ki innocent ladki ko patakar chudai karte video banaya tapori ladke ne,2:08
https://chiggywiggy.com/32368/bhabhi-ji-apki-chut-kitni-tight-hai-aur-tange-kitni-gori-hai-devar-ne-naya-nighty-dilake-bhabhi-ko-tapatap-awaj-aaye-aise-choda/,https://chiggywiggy.com/vfile/32368/32121/2/6413533abbc8025e35ec/1695125034/mp4/32368_720p.mp4,https://chiggywiggy.com/media/videos/tmb/000/032/368/4.jpg,bhabhi ji apki chut kitni tight hai aur tange kitni gori hai devar ne naya nighty dilake bhabhi ko tapatap awaj aaye aise choda,15:42
https://chiggywiggy.com/32078/pahli-baar-chudne-ko-rahi-hui-bare-boobs-wali-meghana-ke-nipples-dabakar-tight-chut-me-ungali-ki-1-of-2/,https://chiggywiggy.com/vfile/32078/31747/2/366ae3706c86c0ff4e5d/1695125035/mp4/32078_480p.mp4,https://chiggywiggy.com/media/videos/tmb/000/032/078/5.jpg,pahli baar chudne ko rahi hui bare boobs wali meghana ke nipples dabakar tight chut me ungali ki 1 of 2,2:18
https://chiggywiggy.com/33809/sexy-milf-mother-fucking-with-young-guy-condom-wearing-dick-drilling-tight-pussy-very-hard/,https://chiggywiggy.com/vfile/33667/33788/1/6c2b6bdf2b094fc81a6a/1695124775/mp4/33667_1080p.mp4,https://chiggywiggy.com/media/videos/tmb/000/033/809/2.jpg,sexy milf mother fucking with young guy condom wearing dick drilling tight pussy very hard,2:20
https://chiggywiggy.com/33597/desi-horny-housewife-sex-and-blowjob-with-ex-boyfriend-in-bathroom-video-indian-amateur-sex-mms/,https://chiggywiggy.com/vfile/33597/33688/1/b4f2a8850fe6088adbfd/1695125035/mp4/33597_720p.mp4,https://chiggywiggy.com/media/videos/tmb/000/033/597/8.jpg,desi horny housewife sex and blowjob with ex boyfriend in bathroom video indian amateur sex mms,2:48
https://chiggywiggy.com/32588/indian-young-couple-first-love-session-boyfriend-squeezing-and-sucking-gf-boobs-in-front-of-camera-2-of-2/,https://chiggywiggy.com/vfile/32588/32426/1/b73ccf595df45f7407f4/1695125035/mp4/32588_480p.mp4,https://chiggywiggy.com/media/videos/tmb/000/032/588/1.jpg,indian young couple first love session boyfriend squeezing and sucking gf boobs in front of camera 2 of 2,2:02
https://chiggywiggy.com/33089/very-beautiful-bhabhi-having-fun-with-husband-and-making-own-sex-video/,https://chiggywiggy.com/vfile/33089/33036/2/8f41ef9641d31a7a4769/1695125035/mp4/33089_1080p.mp4,https://chiggywiggy.com/media/videos/tmb/000/033/089/10.jpg,very beautiful bhabhi having fun with husband and making own sex video,1:15
https://chiggywiggy.com/31880/beautiful-punjabi-bivi-ki-suhagraat-ko-chudai-karte-full-video-recording-2-of-3/,https://chiggywiggy.com/vfile/31880/31504/2/b80da9287697cd0f6f93/1695125035/mp4/31880_720p.mp4,https://chiggywiggy.com/media/videos/tmb/000/031/880/1.jpg,beautiful punjabi bivi ki suhagraat ko chudai karte full video recording 2 of 3,0:42
https://chiggywiggy.com/31970/lambe-dudhi-se-chut-ragadti-bhabhi-ko-dekh-devar-ne-lund-chuswakar-chod-diya/,https://chiggywiggy.com/vfile/33667/33788/1/6c2b6bdf2b094fc81a6a/1695124775/mp4/33667_1080p.mp4,https://chiggywiggy.com/media/videos/tmb/000/031/970/1.jpg,lambe dudhi se chut ragadti bhabhi ko dekh devar ne lund chuswakar chod diya,10:40
https://chiggywiggy.com/32280/dopahar-khule-khet-me-bivi-ki-chudai-jamin-par-kapde-bichake-chudai-phir-lund-ki-sawari-karayi-2-of-2/,https://chiggywiggy.com/vfile/32280/32010/2/819e4c9b643ac02668c1/1695125042/mp4/32280_1080p.mp4,https://chiggywiggy.com/media/videos/tmb/000/032/280/1.jpg,dopahar khule khet me bivi ki chudai jamin par kapde bichake chudai phir lund ki sawari karayi 2 of 2,2:28
https://chiggywiggy.com/33392/telugu-newly-married-wife-vc-hard-masturbation-video-on-video-call-3-of-3/,https://chiggywiggy.com/vfile/33392/33412/2/05d50602014f362ffb62/1695125042/mp4/33392_1080p.mp4,https://chiggywiggy.com/media/videos/tmb/000/033/392/3.jpg,telugu newly married wife vc hard masturbation video on video call 3 of 3,1:13
https://chiggywiggy.com/33293/bade-matkowali-chachi-ki-spooning-sex-pose-me-chudai-hidden-cam-recording/,https://chiggywiggy.com/vfile/33293/33288/2/16935049b0205a8b7d49/1695125042/mp4/33293_720p.mp4,https://chiggywiggy.com/media/videos/tmb/000/033/293/1.jpg,bade matkowali chachi ki spooning sex pose me chudai hidden cam recording,0:24
https://chiggywiggy.com/32989/blue-bra-aur-panty-pehani-sexy-ladki-ne-masturbation-karte-apna-video-banaya/,https://chiggywiggy.com/vfile/32989/32913/1/9c6e989131685ad76364/1695125042/mp4/32989_720p.mp4,https://chiggywiggy.com/media/videos/tmb/000/032/989/10.jpg,blue bra aur panty pehani sexy ladki ne masturbation karte apna video banaya,1:00
https://chiggywiggy.com/32184/ghar-me-mehman-hai-gujarati-bhabhi-ke-sath-room-me-quick-sex-chal-raha-hai/,https://chiggywiggy.com/vfile/32184/31890/1/a73db4119c9e5ca3d44e/1695125042/mp4/32184_720p.mp4,https://chiggywiggy.com/media/videos/tmb/000/032/184/8.jpg,ghar me mehman hai gujarati bhabhi ke sath room me quick sex chal raha hai,1:21
https://chiggywiggy.com/32367/kitni-khubsurat-bhabhi-hai-devar-ne-mobile-ka-camera-on-kiya-to-sharmakar-boobs-chupane-lagi/,https://chiggywiggy.com/vfile/32367/32120/1/0b6638daa226e870bf44/1695125042/mp4/32367_720p.mp4,https://chiggywiggy.com/media/videos/tmb/000/032/367/1.jpg,kitni khubsurat bhabhi hai devar ne mobile ka camera on kiya to sharmakar boobs chupane lagi,0:37
https://chiggywiggy.com/33698/desi-student-tanya-sucking-skinny-boyfriend-cock-and-showing-her-ass-on-cam-riding-roughly-on-his-dick/,https://chiggywiggy.com/vfile/33667/33788/1/6c2b6bdf2b094fc81a6a/1695124775/mp4/33667_1080p.mp4,https://chiggywiggy.com/media/videos/tmb/000/033/698/1.jpg,desi student tanya sucking skinny boyfriend cock and showing her ass on cam riding roughly on his dick,21:58
https://chiggywiggy.com/32692/hot-wife-cheating-sex-lover-inserting-his-big-cock-in-her-tight-asshole/,https://chiggywiggy.com/vfile/32692/32548/1/3eda65e357fd66658b0b/1695125043/mp4/32692_720p.mp4,https://chiggywiggy.com/media/videos/tmb/000/032/692/2.jpg,hot wife cheating sex lover inserting his big cock in her tight asshole,2:29
https://chiggywiggy.com/32077/pakistani-wife-fucked-husband-asking-show-me-boobs-and-shaking-his-dick/,https://chiggywiggy.com/vfile/32077/31746/1/fbada20e13065e84bb1d/1695125043/mp4/32077_480p.mp4,https://chiggywiggy.com/media/videos/tmb/000/032/077/4.jpg,pakistani wife fucked husband asking show me boobs and shaking his dick,1:45
https://chiggywiggy.com/33189/indian-porn-girl-desi-hot-homemade-fuck/,https://chiggywiggy.com/vfile/33189/33157/2/bd91c41f3ec3f23b62d3/1695125043/mp4/33189_720p.mp4,https://chiggywiggy.com/media/videos/tmb/000/033/189/6.jpg,indian porn girl desi hot homemade fuck,0:20
https://chiggywiggy.com/33808/public-bathroom-me-girlfriend-ki-jhukakar-chudai-bade-dudu-kitne-mast-lag-rahe-hai-latakate/,https://chiggywiggy.com/vfile/33667/33788/1/6c2b6bdf2b094fc81a6a/1695124775/mp4/33667_1080p.mp4,https://chiggywiggy.com/media/videos/tmb/000/033/808/1.jpg,public bathroom me girlfriend ki jhukakar chudai bade dudu kitne mast lag rahe hai latakate,1:13
https://chiggywiggy.com/31879/sexy-asian-girlfriend-hard-fucked-without-removing-her-bra-in-missionary-position/,https://chiggywiggy.com/vfile/31879/31503/1/fae546a36aa52ec865af/1695125043/mp4/31879_720p.mp4,https://chiggywiggy.com/media/videos/tmb/000/031/879/4.jpg,sexy asian girlfriend hard fucked without removing her bra in missionary position,1:04
https://chiggywiggy.com/32883/unsatisfied-horny-bhabhi-puri-https://chiggywiggy.com/vfile/33667/33788/1/6c2b6bdf2b094fc81a6a/1695124775/mp4/33667_1080p.mp4gi-hokar-chut-ragad-rahi-hai-aur-apne-hi-boobs-chuste-video-bana-rahi-hai/,https://chiggywiggy.com/vfile/32883/32779/2/8f57a9c23f8b36ba4328/1695125043/mp4/32883_720p.mp4,https://chiggywiggy.com/media/videos/tmb/000/032/883/5.jpg,unsatisfied horny bhabhi puri https:,2:50
https://chiggywiggy.com/32587/chawl-ki-sexy-big-boobs-bhabhi-pati-ke-lund-par-kitna-mast-gand-hilate-uchal-rahi-hai/,https://chiggywiggy.com/vfile/32587/32424/2/056065f97319935b1df1/1695125044/mp4/32587_480p.mp4,https://chiggywiggy.com/media/videos/tmb/000/032/587/5.jpg,chawl ki sexy big boobs bhabhi pati ke lund par kitna mast gand hilate uchal rahi hai,8:23
https://chiggywiggy.com/31969/bivi-ki-chut-ke-baal-saaf-karta-pati-chudai-se-pahle-chut-chikni-chahiye-taki-chat-sake/,https://chiggywiggy.com/vfile/33667/33788/1/6c2b6bdf2b094fc81a6a/1695124775/mp4/33667_1080p.mp4,https://chiggywiggy.com/media/videos/tmb/000/031/969/1.jpg,bivi ki chut ke baal saaf karta pati chudai se pahle chut chikni chahiye taki chat sake,13:53
https://chiggywiggy.com/33596/hot-indian-step-daughter-with-perfect-pussy-gets-fucked-by-stepdad-on-christmas-in-hindi-audio-with-dirty-talk-beautiful-video-free-porn-videos-hclips/,https://chiggywiggy.com/vfile/33596/33687/2/5750753dc0f06a6cf7f9/1695125044/mp4/33596_720p.mp4,https://chiggywiggy.com/media/videos/tmb/000/033/596/3.jpg,hot indian step daughter with perfect pussy gets fucked by stepdad on christmas in hindi audio with dirty talk beautiful video free porn videos hclips,14:05
https://chiggywiggy.com/32279/waah-kya-mast-scene-hai-bhabhi-standing-doggy-me-jhuki-hui-hai-aur-piche-se-lover-hard-shots-mar-raha-hai/,https://chiggywiggy.com/vfile/32279/32008/1/8e7065bcd91bee9d672f/1695125044/mp4/32279_480p.mp4,https://chiggywiggy.com/media/videos/tmb/000/032/279/1.jpg,waah kya mast scene hai bhabhi standing doggy me jhuki hui hai aur piche se lover hard shots mar raha hai,1:20
https://chiggywiggy.com/33088/desi-hijabi-girl-ki-maike-aakar-apne-purane-ashique-se-chudai-yoururfi-first-69-sex-video/,https://chiggywiggy.com/vfile/33088/33034/1/fd406e5869d678fc6174/1695125044/mp4/33088_480p.mp4,https://chiggywiggy.com/media/videos/tmb/000/033/088/1.jpg,desi hijabi girl ki maike aakar apne purane ashique se chudai yoururfi first 69 sex video,11:00
https://chiggywiggy.com/33391/kya-figure-hai-horny-girl-nudes-showing-boobs-hairy-pussy-and-bathing-video-2-of-3/,https://chiggywiggy.com/vfile/33391/33410/1/da1909ebac29e8fa941b/1695125045/mp4/33391_480p.mp4,https://chiggywiggy.com/media/videos/tmb/000/033/391/1.jpg,kya figure hai horny girl nudes showing boobs hairy pussy and bathing video 2 of 3,2:24
https://chiggywiggy.com/32183/catering-workers-ka-khali-bathroom-me-quick-blowjob/,https://chiggywiggy.com/vfile/32183/31889/2/fa23a19255368f807153/1695125045/mp4/32183_720p.mp4,https://chiggywiggy.com/media/videos/tmb/000/032/183/6.jpg,catering workers ka khali bathroom me quick blowjob,3:00
https://chiggywiggy.com/33292/indian-bhabhi-cheating-his-husband-and-fucked-with-his-boyfriend-in-oyo-hotel-room-with-hindi-audio-hd-video/,https://chiggywiggy.com/vfile/33292/33287/1/4d0d495e849b97eace76/1695125045/mp4/33292_720p.mp4,https://chiggywiggy.com/media/videos/tmb/000/033/292/1.jpg,indian bhabhi cheating his husband and fucked with his boyfriend in oyo hotel room with hindi audio hd video,7:48
https://chiggywiggy.com/32366/two-sexy-girlfriend-fucking-with-lucky-guy-after-party/,https://chiggywiggy.com/vfile/32366/32119/2/4434b62d388f41c8e8ba/1695125045/mp4/32366_720p.mp4,https://chiggywiggy.com/media/videos/tmb/000/032/366/7.jpg,two sexy girlfriend fucking with lucky guy after party,2:47
https://chiggywiggy.com/33697/indore-girl-boobs-show-to-lover-viral-mms/,https://chiggywiggy.com/vfile/33667/33788/1/6c2b6bdf2b094fc81a6a/1695124775/mp4/33667_1080p.mp4,https://chiggywiggy.com/media/videos/tmb/000/033/697/1.jpg,indore girl boobs show to lover viral mms,0:53
https://chiggywiggy.com/32076/pados-ki-priya-se-dosti-dosti-me-chudai-bina-bra-utare-tange-utake-chad-gaya/,https://chiggywiggy.com/vfile/32076/31745/2/e1f7533d2765fc5000c9/1695125046/mp4/32076_480p.mp4,https://chiggywiggy.com/media/videos/tmb/000/032/076/4.jpg,pados ki priya se dosti dosti me chudai bina bra utare tange utake chad gaya,1:32
https://chiggywiggy.com/32988/samne-mobile-on-karke-desi-couple-ka-chudai-video-recording/,https://chiggywiggy.com/vfile/32988/32912/2/75137004d844591c4181/1695125046/mp4/32988_720p.mp4,https://chiggywiggy.com/media/videos/tmb/000/032/988/1.jpg,samne mobile on karke desi couple ka chudai video recording,2:54
https://chiggywiggy.com/33497/office-ke-table-par-sulakar-girlfriend-ki-tight-bur-mari/,https://chiggywiggy.com/vfile/33497/33565/2/0f4a6ecbef77fa3520b2/1695125047/mp4/33497_480p.mp4,https://chiggywiggy.com/media/videos/tmb/000/033/497/8.jpg,office ke table par sulakar girlfriend ki tight bur mari,1:45
https://chiggywiggy.com/32586/sexy-biwi-kisi-aur-ke-lund-par-baith-ke-maje-le-rahi-hai-aur-cuckold-husband-ye-sab-record-kar-raha-hai/,https://chiggywiggy.com/vfile/32586/32423/1/f0f100b1c544c4aa9ed1/1695125047/mp4/32586_1080p.mp4,https://chiggywiggy.com/media/videos/tmb/000/032/586/3.jpg,sexy biwi kisi aur ke lund par baith ke maje le rahi hai aur cuckold husband ye sab record kar raha hai,1:53
https://chiggywiggy.com/33188/pakistani-aunty-has-anal-sex-with-her-house-cook-when-husband-out-for-office-with-clear-hindi-audio/,https://chiggywiggy.com/vfile/33188/33156/1/4f9918661f082a00124d/1695125047/mp4/33188_720p.mp4,https://chiggywiggy.com/media/videos/tmb/000/033/188/2.jpg,pakistani aunty has anal sex with her house cook when husband out for office with clear hindi audio,1:10
https://chiggywiggy.com/32278/lockdown-me-boyfriend-se-dur-rah-ke-chudne-ke-liye-pareshan-gf-ne-apne-chut-me-ungali-karte-video-banai/,https://chiggywiggy.com/vfile/32278/32007/2/aa037beaf62eeffe6bb7/1695125047/mp4/32278_480p.mp4,https://chiggywiggy.com/media/videos/tmb/000/032/278/1.jpg,lockdown me boyfriend se dur rah ke chudne ke liye pareshan gf ne apne chut me ungali karte video banai,1:08
https://chiggywiggy.com/33807/mask-lagakar-bhaiya-bhabhi-ka-homemade-sex-video-saree-utakar-condom-laga-land-ghusa-diya-bhabhi-ki-gand-me/,https://chiggywiggy.com/vfile/33667/33788/1/6c2b6bdf2b094fc81a6a/1695124775/mp4/33667_1080p.mp4,https://chiggywiggy.com/media/videos/tmb/000/033/807/1.jpg,mask lagakar bhaiya bhabhi ka homemade sex video saree utakar condom laga land ghusa diya bhabhi ki gand me,2:20
https://chiggywiggy.com/31964/dehati-green-saree-aur-blouse-pehani-bhabhi-ke-boobs-chus-raha-hai-pati-aur-bhabhi-lund-hila-kar-chut-me-lene-me-busy-hai/,https://chiggywiggy.com/vfile/31964/31599/2/7a6ec51b22ccbbb30bcc/1695125047/mp4/31964_720p.mp4,https://chiggywiggy.com/media/videos/tmb/000/031/964/1.jpg,dehati green saree aur blouse pehani bhabhi ke boobs chus raha hai pati aur bhabhi lund hila kar chut me lene me busy hai,0:46
https://chiggywiggy.com/32182/boyfriend-fucking-skinny-girlfriend-in-hotel-room-wearing-condom/,https://chiggywiggy.com/vfile/32182/31888/1/d807561d184e636da901/1695125047/mp4/32182_720p.mp4,https://chiggywiggy.com/media/videos/tmb/000/032/182/4.jpg,boyfriend fucking skinny girlfriend in hotel room wearing condom,1:40
https://chiggywiggy.com/32691/punjabi-girlfriend-boyfriend-homemade-sex-video-big-boobs-gf-riding-fast-till-she-get-tired/,https://chiggywiggy.com/vfile/32691/32547/2/d42f073d3fd0a7845e65/1695125047/mp4/32691_720p.mp4,https://chiggywiggy.com/media/videos/tmb/000/032/691/4.jpg,punjabi girlfriend boyfriend homemade sex video big boobs gf riding fast till she get tired,6:34
https://chiggywiggy.com/33595/horny-college-girl-ka-roughly-masturbation-big-boobs-dikhate-fast-chut-me-pen-dalti-girlfriend-1-of-2/,https://chiggywiggy.com/vfile/33595/33686/1/28ffa78e541f29dbed1c/1695125047/mp4/33595_720p.mp4,https://chiggywiggy.com/media/videos/tmb/000/033/595/1.jpg,horny college girl ka roughly masturbation big boobs dikhate fast chut me pen dalti girlfriend 1 of 2,1:37
https://chiggywiggy.com/32365/aankho-par-kala-patti-pehan-ke-lete-girlfriend-ke-boobs-dabakar-lund-chusaya-very-huge-boobs/,https://chiggywiggy.com/vfile/32365/32118/1/d36228e3f4defe657df0/1695125047/mp4/32365_720p.mp4,https://chiggywiggy.com/media/videos/tmb/000/032/365/8.jpg,aankho par kala patti pehan ke lete girlfriend ke boobs dabakar lund chusaya very huge boobs,3:08
https://chiggywiggy.com/32882/sexy-bhabhi-ki-chudai-karte-video-bana-raha-hai-lover-to-naraj-ho-gayi-bhabhi-kitne-bade-boobs-hai-wow-bhabhi-ke/,https://chiggywiggy.com/vfile/32882/32778/1/cc05f399cfd33a8f87fb/1695125047/mp4/32882_720p.mp4,https://chiggywiggy.com/media/videos/tmb/000/032/882/8.jpg,sexy bhabhi ki chudai karte video bana raha hai lover to naraj ho gayi bhabhi kitne bade boobs hai wow bhabhi ke,0:42
https://chiggywiggy.com/33087/horny-office-girl-pussy-fucking-desi-viral-mms/,https://chiggywiggy.com/vfile/33087/33033/2/1b35b86ac704e3a18734/1695125048/mp4/33087_480p.mp4,https://chiggywiggy.com/media/videos/tmb/000/033/087/2.jpg,horny office girl pussy fucking desi viral mms,1:13
https://chiggywiggy.com/31878/juggi-me-rehte-pati-patni-ne-apni-sex-video-banayi-blowjob-ke-baad-pornstar-ki-tarah-different-positions-me-dhamdar-chudai-2-of-2/,https://chiggywiggy.com/vfile/31878/31502/2/c7c1a11252c5c17cc6b2/1695125047/mp4/31878_720p.mp4,https://chiggywiggy.com/media/videos/tmb/000/031/878/1.jpg,juggi me rehte pati patni ne apni sex video banayi blowjob ke baad pornstar ki tarah different positions me dhamdar chudai 2 of 2,3:50
https://chiggywiggy.com/33390/desi-cute-babe-ki-hard-tapatap-big-boobs-aur-moti-gandwali-ladki-ki-ghodi-me-chudai-1-of-2/,https://chiggywiggy.com/vfile/33390/33409/2/ddfbdf14f8655d94f8df/1695125048/mp4/33390_480p.mp4,https://chiggywiggy.com/media/videos/tmb/000/033/390/9.jpg,desi cute babe ki hard tapatap big boobs aur moti gandwali ladki ki ghodi me chudai 1 of 2,2:56
https://chiggywiggy.com/33496/bhabhi-apke-dudu-bahut-bade-hai-muje-chusna-hai-devar-sucking-big-boobs-of-sister-in-law/,https://chiggywiggy.com/vfile/33496/33564/1/3b5e6aae7c910379b717/1695125048/mp4/33496_480p.mp4,https://chiggywiggy.com/media/videos/tmb/000/033/496/1.jpg,bhabhi apke dudu bahut bade hai muje chusna hai devar sucking big boobs of sister in law,1:08
https://chiggywiggy.com/32987/online-stranger-ke-pyar-me-aunty-ne-apna-blouse-kholkar-apne-mote-boobs-dikhaye/,https://chiggywiggy.com/vfile/32987/32911/1/201b89d935d006640ea5/1695125048/mp4/32987_720p.mp4,https://chiggywiggy.com/media/videos/tmb/000/032/987/6.jpg,online stranger ke pyar me aunty ne apna blouse kholkar apne mote boobs dikhaye,0:28
https://chiggywiggy.com/32075/massage-wali-sexy-lady-ke-sath-massage-ke-baad-rough-chudai-ke-sath-happy-ending-famous-sex-video/,https://chiggywiggy.com/vfile/32075/31744/1/22e9d2a4c30a7e425f21/1695125049/mp4/32075_480p.mp4,https://chiggywiggy.com/media/videos/tmb/000/032/075/1.jpg,massage wali sexy lady ke sath massage ke baad rough chudai ke sath happy ending famous sex video,6:42
https://chiggywiggy.com/33291/hot-girlfriend-ke-boobs-chuste-usi-se-apna-video-record-kara-raha-hai/,https://chiggywiggy.com/vfile/33291/33285/2/2be481384a6381b214d6/1695125048/mp4/33291_480p.mp4,https://chiggywiggy.com/media/videos/tmb/000/033/291/7.jpg,hot girlfriend ke boobs chuste usi se apna video record kara raha hai,2:33
https://chiggywiggy.com/33696/kavya-sharma-gujarati-indian-hot-girl-big-boobs-show-and-rubbing-pussy-in-bedroom-indian-mms-video/,https://chiggywiggy.com/vfile/33667/33788/1/6c2b6bdf2b094fc81a6a/1695124775/mp4/33667_1080p.mp4,https://chiggywiggy.com/media/videos/tmb/000/033/696/1.jpg,kavya sharma gujarati indian hot girl big boobs show and rubbing pussy in bedroom indian mms video,2:00
https://chiggywiggy.com/32483/desi-village-wife-hard-fucked-from-behind-and-recorded-by-hubby/,https://chiggywiggy.com/vfile/32483/32294/1/a80161e4c611d67d47bb/1695125050/mp4/32483_480p.mp4,https://chiggywiggy.com/media/videos/tmb/000/032/483/5.jpg,desi village wife hard fucked from behind and recorded by hubby,6:12
https://chiggywiggy.com/32585/ye-to-sofia-ansari-lagti-hai-par-hai-nahi-couple-ka-bathtub-me-nahate-kissing-and-fucking/,https://chiggywiggy.com/vfile/32585/32421/2/c623c1553090566ef6a7/1695125050/mp4/32585_1080p.mp4,https://chiggywiggy.com/media/videos/tmb/000/032/585/7.jpg,ye to sofia ansari lagti hai par hai nahi couple ka bathtub me nahate kissing and fucking,3:05
https://chiggywiggy.com/33187/indian-bhabi-fucks-with-her-neighbor-in-clear-hindi-audio/,https://chiggywiggy.com/vfile/33187/33155/2/64f0a6a3f4a6d4998f33/1695125050/mp4/33187_720p.mp4,https://chiggywiggy.com/media/videos/tmb/000/033/187/3.jpg,indian bhabi fucks with her neighbor in clear hindi audio,10:11
https://chiggywiggy.com/31963/bangladeshi-beautiful-bhabhi-playing-with-balls-before-sucking-dick/,https://chiggywiggy.com/vfile/31963/31598/1/c9107a532e9d0f54770f/1695125051/mp4/31963_720p.mp4,https://chiggywiggy.com/media/videos/tmb/000/031/963/6.jpg,bangladeshi beautiful bhabhi playing with balls before sucking dick,7:44
https://chiggywiggy.com/32181/dehati-bhabhi-ki-tight-chut-me-condom-lagakar-apna-mota-lund-gusaya/,https://chiggywiggy.com/vfile/32181/31887/2/8257aafff0e67cc5a31e/1695125051/mp4/32181_720p.mp4,https://chiggywiggy.com/media/videos/tmb/000/032/181/5.jpg,dehati bhabhi ki tight chut me condom lagakar apna mota lund gusaya,2:13
https://chiggywiggy.com/33806/beautiful-girl-showing-her-milky-boobs-and-fully-nude-bathing-video-many-video-merged-in-one/,https://chiggywiggy.com/vfile/33667/33788/1/6c2b6bdf2b094fc81a6a/1695124775/mp4/33667_1080p.mp4,https://chiggywiggy.com/media/videos/tmb/000/033/806/1.jpg,beautiful girl showing her milky boobs and fully nude bathing video many video merged in one,9:36
https://chiggywiggy.com/32690/horny-girlfriend-showing-her-big-boobs-and-rubbing-her-pussy-while-recording-it-for-boyfriend/,https://chiggywiggy.com/vfile/32690/32546/1/2593ffb4ed3ace742c35/1695125052/mp4/32690_720p.mp4,https://chiggywiggy.com/media/videos/tmb/000/032/690/4.jpg,horny girlfriend showing her big boobs and rubbing her pussy while recording it for boyfriend,1:42
https://chiggywiggy.com/33594/panty-ko-muh-me-lekar-choot-ko-kitni-buri-tarah-masal-rahi-hai/,https://chiggywiggy.com/vfile/33594/33685/2/00f3f6005c2a4d496290/1695125052/mp4/33594_720p.mp4,https://chiggywiggy.com/media/videos/tmb/000/033/594/1.jpg,panty ko muh me lekar choot ko kitni buri tarah masal rahi hai,0:15
https://chiggywiggy.com/32277/beautiful-bhabhi-removed-her-bra-and-posing-in-front-of-camera-and-recording-full-naked-video/,https://chiggywiggy.com/vfile/32277/32006/1/733278ee195b74c4c088/1695125052/mp4/32277_480p.mp4,https://chiggywiggy.com/media/videos/tmb/000/032/277/9.jpg,beautiful bhabhi removed her bra and posing in front of camera and recording full naked video,2:06
https://chiggywiggy.com/32881/chote-boobs-wali-bhabhi-ki-blouse-bhi-nahi-kholi-kitni-tej-tight-bur-pel-raha-hai-devar/,https://chiggywiggy.com/vfile/32881/32777/2/f82973aac161d525cfe9/1695125052/mp4/32881_720p.mp4,https://chiggywiggy.com/media/videos/tmb/000/032/881/8.jpg,chote boobs wali bhabhi ki blouse bhi nahi kholi kitni tej tight bur pel raha hai devar,3:12
