vdo,dwn,img,title,dur
https://chiggywiggy.com/33214/jija-fucking-sexy-big-boobs-sali-when-wife-is-not-home/,https://chiggywiggy.com/vfile/33667/33788/1/6c2b6bdf2b094fc81a6a/1695124775/mp4/33667_1080p.mp4,https://chiggywiggy.com/media/videos/tmb/000/033/214/8.jpg,jija fucking sexy big boobs sali when wife is not home,4:45
https://chiggywiggy.com/32608/boyfriend-chudai-karte-puch-raha-hai-camera-me-dekho-aur-batao-kaisa-lag-raha-hai/,https://chiggywiggy.com/vfile/33667/33788/1/6c2b6bdf2b094fc81a6a/1695124775/mp4/33667_1080p.mp4,https://chiggywiggy.com/media/videos/tmb/000/032/608/1.jpg,boyfriend chudai karte puch raha hai camera me dekho aur batao kaisa lag raha hai,1:19
https://chiggywiggy.com/33615/big-ass-girl-fucked-by-nerd-boy-for-helping-in-assignments-2-of-2/,https://chiggywiggy.com/vfile/33615/33716/1/2407788232ba53a5f73c/1695124957/mp4/33615_1080p.mp4,https://chiggywiggy.com/media/videos/tmb/000/033/615/1.jpg,big ass girl fucked by nerd boy for helping in assignments 2 of 2,2:37
https://chiggywiggy.com/33421/horny-busty-wife-giving-blowjob-to-huge-cock-playing-with-big-cock-like-her-new-trophie/,https://chiggywiggy.com/vfile/33421/33465/2/23772ec2be0f50398aa7/1695124958/mp4/33421_1080p.mp4,https://chiggywiggy.com/media/videos/tmb/000/033/421/1.jpg,horny busty wife giving blowjob to huge cock playing with big cock like her new trophie,3:21
https://chiggywiggy.com/32904/sexy-cam-girl-showing-boobs-and-tight-pussy-ngewe-mahasiswi-junior-kampus/,https://chiggywiggy.com/vfile/32904/32807/1/a30a281a875bf73c3202/1695124958/mp4/32904_480p.mp4,https://chiggywiggy.com/media/videos/tmb/000/032/904/3.jpg,sexy cam girl showing boobs and tight pussy ngewe mahasiswi junior kampus,6:57
https://chiggywiggy.com/32298/mote-bobe-dabate-bivi-ki-hard-chudai-dehati-couple-homemade-sex-video/,https://chiggywiggy.com/vfile/32298/32038/2/74f69287b8b30425b1e5/1695124958/mp4/32298_720p.mp4,https://chiggywiggy.com/media/videos/tmb/000/032/298/7.jpg,mote bobe dabate bivi ki hard chudai dehati couple homemade sex video,1:06
https://chiggywiggy.com/32105/big-boobs-tamil-wife-sitting-on-husband-dick-husband-fingering-her-pussy-roughly-making-her-moan-loud/,https://chiggywiggy.com/vfile/32105/31782/2/3b03d22a66ab82b3c7e1/1695124958/mp4/32105_480p.mp4,https://chiggywiggy.com/media/videos/tmb/000/032/105/1.jpg,big boobs tamil wife sitting on husband dick husband fingering her pussy roughly making her moan loud,1:19
https://chiggywiggy.com/33516/moti-big-boobs-wali-ke-sath-different-poses-me-palang-tod-pelai-chubby-bhabhi-ki-chudai/,https://chiggywiggy.com/vfile/33667/33788/1/6c2b6bdf2b094fc81a6a/1695124775/mp4/33667_1080p.mp4,https://chiggywiggy.com/media/videos/tmb/000/033/516/2.jpg,moti big boobs wali ke sath different poses me palang tod pelai chubby bhabhi ki chudai,8:52
https://chiggywiggy.com/32813/sexy-onlyfans-babe-boobs-show-and-masturbation-video-leaked-badjatti-2-of-4/,https://chiggywiggy.com/vfile/32813/32688/2/1ca743eaa7b3cb83cd1e/1695124959/mp4/32813_480p.mp4,https://chiggywiggy.com/media/videos/tmb/000/032/813/6.jpg,sexy onlyfans babe boobs show and masturbation video leaked badjatti 2 of 4,4:11
https://chiggywiggy.com/33114/beautiful-housewife-sucking-husband-dick-and-getting-fucked-roughly/,https://chiggywiggy.com/vfile/33114/33068/1/c49775ed2fbc1b8d3748/1695124959/mp4/33114_1080p.mp4,https://chiggywiggy.com/media/videos/tmb/000/033/114/10.jpg,beautiful housewife sucking husband dick and getting fucked roughly,2:08
https://chiggywiggy.com/31897/sassy-poonam-pink-transparent-bra-wearing-and-dancing-on-song-viral-video/,https://chiggywiggy.com/vfile/33667/33788/1/6c2b6bdf2b094fc81a6a/1695124775/mp4/33667_1080p.mp4,https://chiggywiggy.com/media/videos/tmb/000/031/897/4.jpg,sassy poonam pink transparent bra wearing and dancing on song viral video,1:00
https://chiggywiggy.com/32208/lockdown-me-bhabhi-devar-ka-affair-me-blowjob-and-katiya-chudai-video-leaked-4-of-6/,https://chiggywiggy.com/vfile/32208/31918/1/b0fe26961ba1aaefb7ea/1695124960/mp4/32208_720p.mp4,https://chiggywiggy.com/media/videos/tmb/000/032/208/1.jpg,lockdown me bhabhi devar ka affair me blowjob and katiya chudai video leaked 4 of 6,1:06
https://chiggywiggy.com/33315/beautiful-unsatisfied-bhabhi-boobs-dikhakar-lalcha-rahi-hai-aur-apne-stiff-nipples-wall-par-ragad-rahi-hai-kamukta-me/,https://chiggywiggy.com/vfile/33315/33317/2/f31ed800ed6683e8e523/1695124960/mp4/33315_720p.mp4,https://chiggywiggy.com/media/videos/tmb/000/033/315/1.jpg,beautiful unsatisfied bhabhi boobs dikhakar lalcha rahi hai aur apne stiff nipples wall par ragad rahi hai kamukta me,1:11
https://chiggywiggy.com/33420/sexy-lily-masturbating-in-shower-big-boobs-sexy-babe/,https://chiggywiggy.com/vfile/33420/33463/1/263705ad55e4d048a97b/1695124961/mp4/33420_1080p.mp4,https://chiggywiggy.com/media/videos/tmb/000/033/420/1.jpg,sexy lily masturbating in shower big boobs sexy babe,0:20
https://chiggywiggy.com/33208/sexy-indian-model-big-boobs-sucking-and-kissing-by-rich-boyfriend-hd-sex-video/,https://chiggywiggy.com/vfile/33208/33177/1/8c76a94e95ad648c3e0c/1695124961/mp4/33208_720p.mp4,https://chiggywiggy.com/media/videos/tmb/000/033/208/4.jpg,sexy indian model big boobs sucking and kissing by rich boyfriend hd sex video,2:19
https://chiggywiggy.com/33614/car-me-badi-gandwali-bhabhi-ke-boobs-chuskar-tapatap-2-of-2/,https://chiggywiggy.com/vfile/33614/33714/2/b53aa70967181305b84a/1695124962/mp4/33614_1080p.mp4,https://chiggywiggy.com/media/videos/tmb/000/033/614/3.jpg,car me badi gandwali bhabhi ke boobs chuskar tapatap 2 of 2,1:01
https://chiggywiggy.com/32607/horny-arab-girl-in-burqa-showing-her-big-boobs-and-big-butt-on-cam/,https://chiggywiggy.com/vfile/33667/33788/1/6c2b6bdf2b094fc81a6a/1695124775/mp4/33667_1080p.mp4,https://chiggywiggy.com/media/videos/tmb/000/032/607/1.jpg,horny arab girl in burqa showing her big boobs and big butt on cam,3:00
https://chiggywiggy.com/33830/desi-college-girl-with-big-breast-recording-her-masturbation-video-and-showing-her-boobs-squeezing-3-of-3/,https://chiggywiggy.com/vfile/33830/33990/2/0256f434fb2785e685a0/1695124961/mp4/33830_720p.mp4,https://chiggywiggy.com/media/videos/tmb/000/033/830/1.jpg,desi college girl with big breast recording her masturbation video and showing her boobs squeezing 3 of 3,2:50
https://chiggywiggy.com/33113/bhabhi-ki-baho-me-sokar-kitne-pyar-se-bhabhi-ke-dudu-pee-raha-hai-devar/,https://chiggywiggy.com/vfile/33113/33066/2/04bac60d82505126523b/1695124962/mp4/33113_480p.mp4,https://chiggywiggy.com/media/videos/tmb/000/033/113/1.jpg,bhabhi ki baho me sokar kitne pyar se bhabhi ke dudu pee raha hai devar,1:08
https://chiggywiggy.com/32506/middle-aged-indian-married-man-fucking-neighbourhood-college-girlfriend-1-of-3/,https://chiggywiggy.com/vfile/32506/32321/2/47cff4dcdaa0d5875ce1/1695124962/mp4/32506_720p.mp4,https://chiggywiggy.com/media/videos/tmb/000/032/506/1.jpg,middle aged indian married man fucking neighbourhood college girlfriend 1 of 3,2:12
https://chiggywiggy.com/33494/young-couple-kissing-romance-and-boob-sucking-part-2/,https://chiggywiggy.com/vfile/33494/33562/1/f7a976940b65d0e2eb69/1695124962/mp4/33494_1080p.mp4,https://chiggywiggy.com/media/videos/tmb/000/033/494/1.jpg,young couple kissing romance and boob sucking part 2,2:55
https://chiggywiggy.com/32398/village-sexy-prostitute-big-boobs-sucked-by-customer-and-fucking-her-hard/,https://chiggywiggy.com/vfile/32398/32166/1/74861b73dc4d1a1ab04e/1695124962/mp4/32398_1080p.mp4,https://chiggywiggy.com/media/videos/tmb/000/032/398/2.jpg,village sexy prostitute big boobs sucked by customer and fucking her hard,6:41
https://chiggywiggy.com/32297/nikal-gaya-kya-are-re-re-tu-ruk-muje-camera-tikane-de-big-boobs-gf-self-recording-video/,https://chiggywiggy.com/vfile/32297/32037/1/df604f8d475a89db4d0d/1695124962/mp4/32297_720p.mp4,https://chiggywiggy.com/media/videos/tmb/000/032/297/10.jpg,nikal gaya kya are re re tu ruk muje camera tikane de big boobs gf self recording video,0:54
https://chiggywiggy.com/32104/indian-wife-and-husband-trying-first-anal-sex-wife-screaming-loud-with-pain/,https://chiggywiggy.com/vfile/32104/31781/1/711e5186b8d5d514c3ad/1695124962/mp4/32104_480p.mp4,https://chiggywiggy.com/media/videos/tmb/000/032/104/5.jpg,indian wife and husband trying first anal sex wife screaming loud with pain,2:19
https://chiggywiggy.com/32809/sexy-onlyfans-babe-boobs-show-and-masturbation-video-leaked-badjatti-3-of-4/,https://chiggywiggy.com/vfile/32809/32684/2/dff9c5c1beecc587324d/1695124963/mp4/32809_480p.mp4,https://chiggywiggy.com/media/videos/tmb/000/032/809/8.jpg,sexy onlyfans babe boobs show and masturbation video leaked badjatti 3 of 4,2:35
https://chiggywiggy.com/33300/malti-markam/,https://chiggywiggy.com/vfile/33300/33296/1/1a4ef95d30b2fd8dbb64/1695124963/mp4/33300_480p.mp4,https://chiggywiggy.com/media/videos/tmb/000/033/300/1.jpg,malti markam,3:55
https://chiggywiggy.com/32903/rich-sexy-aunty-fucking-with-young-boy-and-recording-own-video/,https://chiggywiggy.com/vfile/32903/32806/2/79ee166e84d8d24dec6a/1695124963/mp4/32903_480p.mp4,https://chiggywiggy.com/media/videos/tmb/000/032/903/3.jpg,rich sexy aunty fucking with young boy and recording own video,5:12
https://chiggywiggy.com/31896/raat-ke-andhere-me-bivi-ki-chudai-karte-video-recording-bivi-kah-rahi-hai-video-mat-banao-hindi-talk/,https://chiggywiggy.com/vfile/33667/33788/1/6c2b6bdf2b094fc81a6a/1695124775/mp4/33667_1080p.mp4,https://chiggywiggy.com/media/videos/tmb/000/031/896/2.jpg,raat ke andhere me bivi ki chudai karte video recording bivi kah rahi hai video mat banao hindi talk,0:51
https://chiggywiggy.com/32207/gaon-ki-mast-chori-ki-condom-lagakar-hard-chudai-aaj-kuch-jyada-nikal-raha-hai/,https://chiggywiggy.com/vfile/32207/31917/2/ab1417f1c73bf1553732/1695124963/mp4/32207_720p.mp4,https://chiggywiggy.com/media/videos/tmb/000/032/207/1.jpg,gaon ki mast chori ki condom lagakar hard chudai aaj kuch jyada nikal raha hai,4:11
https://chiggywiggy.com/33419/beautiful-big-boob-bhabi-hardcore-fucking-dehati-wife-cheating-with-lover/,https://chiggywiggy.com/vfile/33419/33461/2/fd9d37776fd861439171/1695124964/mp4/33419_1080p.mp4,https://chiggywiggy.com/media/videos/tmb/000/033/419/9.jpg,beautiful big boob bhabi hardcore fucking dehati wife cheating with lover,0:50
https://chiggywiggy.com/33205/indian-wife-punished-with-bbc-cock-by-cuckold-husband-for-having-a-boyfriend-in-office/,https://chiggywiggy.com/vfile/33205/33173/2/41d357f427c16ee28633/1695124964/mp4/33205_720p.mp4,https://chiggywiggy.com/media/videos/tmb/000/033/205/5.jpg,indian wife punished with bbc cock by cuckold husband for having a boyfriend in office,3:35
https://chiggywiggy.com/33613/are-bc-idhar-bhi-aajkal-nal-ka-kharab-hone-lag-gaya-hai-meme-viral-video-mms/,https://chiggywiggy.com/vfile/33613/33712/2/0c1e1c3c9e795e5b9c94/1695124965/mp4/33613_1080p.mp4,https://chiggywiggy.com/media/videos/tmb/000/033/613/5.jpg,are bc idhar bhi aajkal nal ka kharab hone lag gaya hai meme viral video mms,15:09
https://chiggywiggy.com/33515/unsatisfied-aunty-ki-saree-utakar-bedroom-me-quick-chudai/,https://chiggywiggy.com/vfile/33515/33588/2/f957d854a876cde3430b/1695124965/mp4/33515_720p.mp4,https://chiggywiggy.com/media/videos/tmb/000/033/515/6.jpg,unsatisfied aunty ki saree utakar bedroom me quick chudai,1:18
https://chiggywiggy.com/33829/famous-cute-tv-host-latest-surprising-onlyfans-exclusive-ppv-5-minutes-full-hd-giving-blowjob-to-her-boyfriend-viral-video/,https://chiggywiggy.com/vfile/33829/33989/1/1f450d950dbec6645666/1695124965/mp4/33829_720p.mp4,https://chiggywiggy.com/media/videos/tmb/000/033/829/1.jpg,famous cute tv host latest surprising onlyfans exclusive ppv 5 minutes full hd giving blowjob to her boyfriend viral video,5:14
https://chiggywiggy.com/32605/cute-shy-girlfriend-hiding-her-face-with-pillow-when-boyfriend-making-her-video/,https://chiggywiggy.com/vfile/32605/32448/2/a8b3f6a161f315d6493e/1695124965/mp4/32605_480p.mp4,https://chiggywiggy.com/media/videos/tmb/000/032/605/1.jpg,cute shy girlfriend hiding her face with pillow when boyfriend making her video,6:25
https://chiggywiggy.com/33111/hairy-pussy-nri-girl-fucking-with-her-foreigner-boyfriend-blowjob-and-rough-fucking-in-front-of-camera/,https://chiggywiggy.com/vfile/33111/33064/2/dd7ee918da532dad83f9/1695124966/mp4/33111_480p.mp4,https://chiggywiggy.com/media/videos/tmb/000/033/111/6.jpg,hairy pussy nri girl fucking with her foreigner boyfriend blowjob and rough fucking in front of camera,11:45
https://chiggywiggy.com/32296/dehati-bhabhi-ka-trouble-trouble-ek-lund-muh-me-aur-ek-chut-me-hard-threesome/,https://chiggywiggy.com/vfile/32296/32036/2/4eb6541d22fa9650a33a/1695124966/mp4/32296_720p.mp4,https://chiggywiggy.com/media/videos/tmb/000/032/296/2.jpg,dehati bhabhi ka trouble trouble ek lund muh me aur ek chut me hard threesome,0:40
https://chiggywiggy.com/33725/sexy-punjabi-girl-sucking-big-black-cock-and-fucked-hardly-rakhi-gill-onlyfans-premium-video/,https://chiggywiggy.com/vfile/33725/33849/1/260d2ab364075655d3b4/1695124966/mp4/33725_720p.mp4,https://chiggywiggy.com/media/videos/tmb/000/033/725/1.jpg,sexy punjabi girl sucking big black cock and fucked hardly rakhi gill onlyfans premium video,8:06
https://chiggywiggy.com/32397/desi-couple-homemade-sex-video-passionately-hubby-fucking-his-wife-in-missionary-pose/,https://chiggywiggy.com/vfile/32397/32164/2/2dcd13b7792649cc729f/1695124966/mp4/32397_1080p.mp4,https://chiggywiggy.com/media/videos/tmb/000/032/397/1.jpg,desi couple homemade sex video passionately hubby fucking his wife in missionary pose,1:05
https://chiggywiggy.com/32901/gubbare-jaise-fule-hue-big-boobs-ko-chuste-chut-me-ungali-karta-boyfriend/,https://chiggywiggy.com/vfile/32901/32804/2/1e72b5f928ff899ed5dc/1695124966/mp4/32901_720p.mp4,https://chiggywiggy.com/media/videos/tmb/000/032/901/2.jpg,gubbare jaise fule hue big boobs ko chuste chut me ungali karta boyfriend,1:10
https://chiggywiggy.com/31895/online-friend-bani-ladki-ko-movie-ke-baad-room-par-lakar-chudai-karte-video-banaya-1-of-2/,https://chiggywiggy.com/vfile/33667/33788/1/6c2b6bdf2b094fc81a6a/1695124775/mp4/33667_1080p.mp4,https://chiggywiggy.com/media/videos/tmb/000/031/895/1.jpg,online friend bani ladki ko movie ke baad room par lakar chudai karte video banaya 1 of 2,6:27
https://chiggywiggy.com/32806/dehati-bhabhi-ka-kaam-ke-bahane-lover-se-khatiya-par-pelai-hidden-video/,https://chiggywiggy.com/vfile/33667/33788/1/6c2b6bdf2b094fc81a6a/1695124775/mp4/33667_1080p.mp4,https://chiggywiggy.com/media/videos/tmb/000/032/806/9.jpg,dehati bhabhi ka kaam ke bahane lover se khatiya par pelai hidden video,12:14
https://chiggywiggy.com/32505/sexy-tango-girl-naked-dancing-on-live-video-shaking-her-big-boobs-and-ass-chiks/,https://chiggywiggy.com/vfile/32505/32320/1/f4d757331c24bc16db70/1695124967/mp4/32505_720p.mp4,https://chiggywiggy.com/media/videos/tmb/000/032/505/2.jpg,sexy tango girl naked dancing on live video shaking her big boobs and ass chiks,10:03
https://chiggywiggy.com/32102/indian-gf-playing-with-her-big-boobs-and-fat-pussy-with-black-dildo-indian-cam-girl/,https://chiggywiggy.com/vfile/33667/33788/1/6c2b6bdf2b094fc81a6a/1695124775/mp4/33667_1080p.mp4,https://chiggywiggy.com/media/videos/tmb/000/032/102/1.jpg,indian gf playing with her big boobs and fat pussy with black dildo indian cam girl,1:01
https://chiggywiggy.com/33514/asian-girlfriend-blindfolded-roughly-riding-in-boyfriend-s-room/,https://chiggywiggy.com/vfile/33514/33587/1/5182e16a8dde739aa460/1695124967/mp4/33514_720p.mp4,https://chiggywiggy.com/media/videos/tmb/000/033/514/1.jpg,asian girlfriend blindfolded roughly riding in boyfriend s room,4:32
https://chiggywiggy.com/33418/beautiful-girl-nice-boob-give-blowjob-rubbing-cock-in-between-her-boobs/,https://chiggywiggy.com/vfile/33418/33459/1/437a96aa0e6219acb094/1695124967/mp4/33418_1080p.mp4,https://chiggywiggy.com/media/videos/tmb/000/033/418/8.jpg,beautiful girl nice boob give blowjob rubbing cock in between her boobs,0:30
https://chiggywiggy.com/33828/aaj-bhi-aunty-me-puri-garmi-hai-pure-maje-de-rahi-hai-uncle-ko-uchal-uchal-kar/,https://chiggywiggy.com/vfile/33828/33988/2/8e97f92ca92efef7f4a1/1695124967/mp4/33828_720p.mp4,https://chiggywiggy.com/media/videos/tmb/000/033/828/5.jpg,aaj bhi aunty me puri garmi hai pure maje de rahi hai uncle ko uchal uchal kar,1:47
https://chiggywiggy.com/31993/pink-saree-aur-blouse-pehani-lucknow-ki-beautiful-bhabhi-ke-boobs-dabakar-chuse-aur-ek-tang-utake-hard-chudai/,https://chiggywiggy.com/vfile/31993/31635/1/7b951212288332e3d54d/1695124967/mp4/31993_1080p.mp4,https://chiggywiggy.com/media/videos/tmb/000/031/993/1.jpg,pink saree aur blouse pehani lucknow ki beautiful bhabhi ke boobs dabakar chuse aur ek tang utake hard chudai,7:46
https://chiggywiggy.com/32206/desi-hot-girl-showing-her-boobs-and-playing-with-them-for-boyfriend-3-of-3/,https://chiggywiggy.com/vfile/32206/31916/1/07ca62ec1045f8225632/1695124967/mp4/32206_720p.mp4,https://chiggywiggy.com/media/videos/tmb/000/032/206/1.jpg,desi hot girl showing her boobs and playing with them for boyfriend 3 of 3,0:56
https://chiggywiggy.com/33110/khule-me-kaise-khade-khade-fatafat-chudai-kar-rahe-hai-koi-dekh-lega-is-baat-ka-dar-bhi-nahi-hai/,https://chiggywiggy.com/vfile/33110/33063/1/bdb2df09e2c0e7f9099f/1695124967/mp4/33110_480p.mp4,https://chiggywiggy.com/media/videos/tmb/000/033/110/4.jpg,khule me kaise khade khade fatafat chudai kar rahe hai koi dekh lega is baat ka dar bhi nahi hai,0:54
https://chiggywiggy.com/33204/kamasutra-desi-bhabhi-teaches-young-devar-about-sex-hindi-audio-bollywood-taboo-story-pov-indian/,https://chiggywiggy.com/vfile/33204/33172/1/8f7602671f5f743d9fa4/1695124967/mp4/33204_720p.mp4,https://chiggywiggy.com/media/videos/tmb/000/033/204/1.jpg,kamasutra desi bhabhi teaches young devar about sex hindi audio bollywood taboo story pov indian,15:37
https://chiggywiggy.com/33612/poonam-pandey-red-one-piece-isne-to-seducing-dance-karte-sabkuch-dikha-diya-viral-video-mms/,https://chiggywiggy.com/vfile/33612/33710/2/71b895ac5be9c72987c0/1695124967/mp4/33612_1080p.mp4,https://chiggywiggy.com/media/videos/tmb/000/033/612/1.jpg,poonam pandey red one piece isne to seducing dance karte sabkuch dikha diya viral video mms,9:15
https://chiggywiggy.com/32295/kitni-cute-hai-ye-karo-na-kya-tum-karoge-kehte-mast-lund-chusti-cutie/,https://chiggywiggy.com/vfile/32295/32035/1/276f5b3a94aa399f2c7e/1695124967/mp4/32295_720p.mp4,https://chiggywiggy.com/media/videos/tmb/000/032/295/3.jpg,kitni cute hai ye karo na kya tum karoge kehte mast lund chusti cutie,1:33
https://chiggywiggy.com/32395/boyfriend-se-mast-chudti-saheli-ka-video-recording-karti-bestie/,https://chiggywiggy.com/vfile/32395/32161/2/d03d4c5dd376140f287b/1695124968/mp4/32395_480p.mp4,https://chiggywiggy.com/media/videos/tmb/000/032/395/1.jpg,boyfriend se mast chudti saheli ka video recording karti bestie,1:24
https://chiggywiggy.com/32604/desi-couple-homemade-sex-video-big-boobs-girlfriend-riding-and-her-pussy-sucked/,https://chiggywiggy.com/vfile/32604/32447/1/1462acb335f80ef3efdd/1695124968/mp4/32604_480p.mp4,https://chiggywiggy.com/media/videos/tmb/000/032/604/1.jpg,desi couple homemade sex video big boobs girlfriend riding and her pussy sucked,11:24
https://chiggywiggy.com/33724/desi-cute-girlfriend-boobs-show-and-riding-shaking-boobs-clips-1-of-3/,https://chiggywiggy.com/vfile/33724/33848/2/7dfda3f0225833c85f83/1695124968/mp4/33724_1080p.mp4,https://chiggywiggy.com/media/videos/tmb/000/033/724/5.jpg,desi cute girlfriend boobs show and riding shaking boobs clips 1 of 3,2:32
https://chiggywiggy.com/31894/pas-ke-sunsan-pade-ghar-me-mile-couple-aur-jamin-par-letkar-maje-kiye/,https://chiggywiggy.com/vfile/33667/33788/1/6c2b6bdf2b094fc81a6a/1695124775/mp4/33667_1080p.mp4,https://chiggywiggy.com/media/videos/tmb/000/031/894/3.jpg,pas ke sunsan pade ghar me mile couple aur jamin par letkar maje kiye,1:32
https://chiggywiggy.com/32900/sexy-milf-maid-ready-for-sex-hid-her-face-with-cloth-when-he-recording-video/,https://chiggywiggy.com/vfile/32900/32803/1/71cb754b49dd84ea4b15/1695124969/mp4/32900_480p.mp4,https://chiggywiggy.com/media/videos/tmb/000/032/900/1.jpg,sexy milf maid ready for sex hid her face with cloth when he recording video,1:22
https://chiggywiggy.com/32099/couple-playing-roleplay-aunty-ye-chut-to-bahut-soft-hai-aur-garam-hai/,https://chiggywiggy.com/vfile/32099/31774/1/32723986552027b7d5f2/1695124970/mp4/32099_720p.mp4,https://chiggywiggy.com/media/videos/tmb/000/032/099/8.jpg,couple playing roleplay aunty ye chut to bahut soft hai aur garam hai,7:00
https://chiggywiggy.com/32504/sexy-bitch-ass-grinding-in-standing-doggy-she-moaning-loud-and-saying-slow-down/,https://chiggywiggy.com/vfile/32504/32319/2/4ec6c22395c12009f8e7/1695124970/mp4/32504_720p.mp4,https://chiggywiggy.com/media/videos/tmb/000/032/504/1.jpg,sexy bitch ass grinding in standing doggy she moaning loud and saying slow down,1:30
https://chiggywiggy.com/33513/pakistani-cute-girlfriend-tight-pussy-video-recording-by-her-boyfriend/,https://chiggywiggy.com/vfile/33513/33586/2/f3c849ee1926de0496f9/1695124970/mp4/33513_720p.mp4,https://chiggywiggy.com/media/videos/tmb/000/033/513/1.jpg,pakistani cute girlfriend tight pussy video recording by her boyfriend,0:45
https://chiggywiggy.com/32805/sexy-indian-girlfriend-showing-her-big-boobs-on-video-call/,https://chiggywiggy.com/vfile/33667/33788/1/6c2b6bdf2b094fc81a6a/1695124775/mp4/33667_1080p.mp4,https://chiggywiggy.com/media/videos/tmb/000/032/805/9.jpg,sexy indian girlfriend showing her big boobs on video call,1:59
https://chiggywiggy.com/33008/cuckold-boyfriend-ki-gf-ko-chudte-dekhne-ki-fantasy-me-apne-best-se-chudwaya-gf-ko/,https://chiggywiggy.com/vfile/33008/32935/2/5f85117b9d4e3052810c/1695124970/mp4/33008_480p.mp4,https://chiggywiggy.com/media/videos/tmb/000/033/008/1.jpg,cuckold boyfriend ki gf ko chudte dekhne ki fantasy me apne best se chudwaya gf ko,1:34
https://chiggywiggy.com/31992/dost-ki-asantust-bivi-ko-hotel-lejakar-pela-chubby-bhabhi-ki-ghodi-banake-chudai/,https://chiggywiggy.com/vfile/31992/31633/2/199d49b1bb9995e686df/1695124971/mp4/31992_1080p.mp4,https://chiggywiggy.com/media/videos/tmb/000/031/992/4.jpg,dost ki asantust bivi ko hotel lejakar pela chubby bhabhi ki ghodi banake chudai,9:27
https://chiggywiggy.com/32205/highway-ke-baju-sunsan-jadiyo-ke-khule-me-girlfriend-ki-chut-me-ungali-karke-hard-chudai/,https://chiggywiggy.com/vfile/33667/33788/1/6c2b6bdf2b094fc81a6a/1695124775/mp4/33667_1080p.mp4,https://chiggywiggy.com/media/videos/tmb/000/032/205/1.jpg,highway ke baju sunsan jadiyo ke khule me girlfriend ki chut me ungali karke hard chudai,2:20
https://chiggywiggy.com/33827/horny-girl-showing-boobs-amp-fingering-pussy-before-bath-desi-girl-big-boobs-pressing-for-bf/,https://chiggywiggy.com/vfile/33827/33987/1/e03c34167d890fd23293/1695124971/mp4/33827_720p.mp4,https://chiggywiggy.com/media/videos/tmb/000/033/827/1.jpg,horny girl showing boobs amp fingering pussy before bath desi girl big boobs pressing for bf,4:40
https://chiggywiggy.com/32710/bhai-aur-behan-ki-chudai-horny-step-sister-ki-chudne-ki-icha-bhai-ne-puri-ki/,https://chiggywiggy.com/vfile/32710/32569/2/ee5b1fe4e79759031a98/1695124971/mp4/32710_720p.mp4,https://chiggywiggy.com/media/videos/tmb/000/032/710/1.jpg,bhai aur behan ki chudai horny step sister ki chudne ki icha bhai ne puri ki,17:32
https://chiggywiggy.com/32899/girlfriend-ki-pahli-baar-gand-me-lund-dalne-ki-koshish-nariyal-tel-dalke-mota-lund-ghusa-raha-hai-loud-moaning/,https://chiggywiggy.com/vfile/32899/32802/2/9a62ff127fe0dc0ef97d/1695124971/mp4/32899_720p.mp4,https://chiggywiggy.com/media/videos/tmb/000/032/899/4.jpg,girlfriend ki pahli baar gand me lund dalne ki koshish nariyal tel dalke mota lund ghusa raha hai loud moaning,9:38
https://chiggywiggy.com/33203/the-hot-maid-kaanta-bai-caught-red-handed-and-fucked-hard-in-all-her-holes/,https://chiggywiggy.com/vfile/33203/33171/2/f04ffd57cdfd20d077f2/1695124971/mp4/33203_720p.mp4,https://chiggywiggy.com/media/videos/tmb/000/033/203/1.jpg,the hot maid kaanta bai caught red handed and fucked hard in all her holes,9:54
https://chiggywiggy.com/33417/horny-desi-wife-enjoying-big-cock-ride-deahti-couple-trying-porn-video-position/,https://chiggywiggy.com/vfile/33417/33457/2/7f0918082cd75a7ee1be/1695124971/mp4/33417_1080p.mp4,https://chiggywiggy.com/media/videos/tmb/000/033/417/4.jpg,horny desi wife enjoying big cock ride deahti couple trying porn video position,6:32
https://chiggywiggy.com/32503/middle-aged-indian-married-man-fucking-neighbourhood-college-girlfriend-3-of-3/,https://chiggywiggy.com/vfile/32503/32318/1/0e0abacc80d2a50b6278/1695124972/mp4/32503_720p.mp4,https://chiggywiggy.com/media/videos/tmb/000/032/503/1.jpg,middle aged indian married man fucking neighbourhood college girlfriend 3 of 3,2:05
https://chiggywiggy.com/33109/classic-desi-couple-low-quality-homemade-sex-video/,https://chiggywiggy.com/vfile/33667/33788/1/6c2b6bdf2b094fc81a6a/1695124775/mp4/33667_1080p.mp4,https://chiggywiggy.com/media/videos/tmb/000/033/109/1.jpg,classic desi couple low quality homemade sex video,17:39
https://chiggywiggy.com/33723/desi-cute-girlfriend-boobs-show-and-riding-shaking-boobs-clips-3-of-3/,https://chiggywiggy.com/vfile/33723/33846/1/0e60eda3da1f8affc484/1695124972/mp4/33723_1080p.mp4,https://chiggywiggy.com/media/videos/tmb/000/033/723/1.jpg,desi cute girlfriend boobs show and riding shaking boobs clips 3 of 3,1:28
https://chiggywiggy.com/32393/dost-ban-nahi-rahe-the-ye-apni-gali-ki-sexy-ladki-ko-chodta-hai-aaj-isne-chudai-karte-video-hi-bana-liya/,https://chiggywiggy.com/vfile/32393/32159/2/231e4ecfe012dacb9fab/1695124972/mp4/32393_480p.mp4,https://chiggywiggy.com/media/videos/tmb/000/032/393/3.jpg,dost ban nahi rahe the ye apni gali ki sexy ladki ko chodta hai aaj isne chudai karte video hi bana liya,0:41
