vdo,dwn,img,title,dur
https://chiggywiggy.com/33061/badi-didi-ne-chote-bhai-ko-chodna-sikhaya-akele-me-didi-ne-bhai-se-chudwaya-2-of-2/,https://chiggywiggy.com/vfile/33667/33788/1/6c2b6bdf2b094fc81a6a/1695124775/mp4/33667_1080p.mp4,https://chiggywiggy.com/media/videos/tmb/000/033/061/1.jpg,badi didi ne chote bhai ko chodna sikhaya akele me didi ne bhai se chudwaya 2 of 2,2:26
https://chiggywiggy.com/33796/bhai-trust-me-dono-ek-hi-hai-meme-video-princesa-priya-meme-viral-video/,https://chiggywiggy.com/vfile/33796/33952/2/60dc009e62bda5a98f71/1695125130/mp4/33796_720p.mp4,https://chiggywiggy.com/media/videos/tmb/000/033/796/4.jpg,bhai trust me dono ek hi hai meme video princesa priya meme viral video,3:05
https://chiggywiggy.com/33881/choot-par-thuk-lagakar-ragad-ke-is-ladki-ne-kitna-sara-pani-nikal-diya/,https://chiggywiggy.com/vfile/33881/34050/1/c1a9b998fc3b9d15ddc8/1695125132/mp4/33881_1080p.mp4,https://chiggywiggy.com/media/videos/tmb/000/033/881/7.jpg,choot par thuk lagakar ragad ke is ladki ne kitna sara pani nikal diya,0:17
https://chiggywiggy.com/32043/hotel-me-room-nahi-mila-to-car-ko-highway-ke-baaju-me-rok-kar-car-me-hi-beautiful-gf-ki-chikni-chut-me-lund-gusaya/,https://chiggywiggy.com/vfile/32043/31697/1/2a2694b5081769e53013/1695124775/mp4/32043_720p.mp4,https://chiggywiggy.com/media/videos/tmb/000/032/043/1.jpg,hotel me room nahi mila to car ko highway ke baaju me rok kar car me hi beautiful gf ki chikni chut me lund gusaya,2:50
https://chiggywiggy.com/33255/sofia-leone-fucked-in-missionary-style-with-lover/,https://chiggywiggy.com/vfile/33667/33788/1/6c2b6bdf2b094fc81a6a/1695124775/mp4/33667_1080p.mp4,https://chiggywiggy.com/media/videos/tmb/000/033/255/1.jpg,sofia leone fucked in missionary style with lover,2:13
https://chiggywiggy.com/33166/beautiful-indian-girl-sucking-dick-like-chpcolate/,https://chiggywiggy.com/vfile/33166/33131/1/d4eabae7599624174c17/1695124775/mp4/33166_720p.mp4,https://chiggywiggy.com/media/videos/tmb/000/033/166/1.jpg,beautiful indian girl sucking dick like chpcolate,0:51
https://chiggywiggy.com/33667/reth-me-khel-rahi-hai-aake-mere-land-par-khel-cute-girl-naked-in-sand/,https://chiggywiggy.com/vfile/33667/33788/1/6c2b6bdf2b094fc81a6a/1695124775/mp4/33667_1080p.mp4,https://chiggywiggy.com/media/videos/tmb/000/033/667/1.jpg,reth me khel rahi hai aake mere land par khel cute girl naked in sand,0:16
https://chiggywiggy.com/32346/tej-chudai-ke-baad-bhabhi-ke-bhur-se-safed-cream-nikal-raha-hai-phir-bhi-bhaiya-ka-abhi-lund-dila-nahi-hua/,https://chiggywiggy.com/vfile/32346/32090/2/fa519e93cbe5aad641c1/1695124775/mp4/32346_480p.mp4,https://chiggywiggy.com/media/videos/tmb/000/032/346/1.jpg,tej chudai ke baad bhabhi ke bhur se safed cream nikal raha hai phir bhi bhaiya ka abhi lund dila nahi hua,2:33
https://chiggywiggy.com/32559/viral-couple-roleplay-husband-wife-sex-video-hunter-asia/,https://chiggywiggy.com/vfile/32559/32394/1/990b1813575b4032dcc9/1695124775/mp4/32559_720p.mp4,https://chiggywiggy.com/media/videos/tmb/000/032/559/4.jpg,viral couple roleplay husband wife sex video hunter asia,8:19
https://chiggywiggy.com/32966/marvi-chowdhury-showing-her-big-butt-and-fingering-her-tight-pussy-on-cam-video/,https://chiggywiggy.com/vfile/32966/32885/2/c29932a5d1f436c4f38c/1695124775/mp4/32966_720p.mp4,https://chiggywiggy.com/media/videos/tmb/000/032/966/1.jpg,marvi chowdhury showing her big butt and fingering her tight pussy on cam video,3:27
https://chiggywiggy.com/33060/do-dosto-ka-apni-girlfriends-ke-sath-group-sex-ek-hi-hotel-room-me/,https://chiggywiggy.com/vfile/33667/33788/1/6c2b6bdf2b094fc81a6a/1695124775/mp4/33667_1080p.mp4,https://chiggywiggy.com/media/videos/tmb/000/033/060/1.jpg,do dosto ka apni girlfriends ke sath group sex ek hi hotel room me,10:09
https://chiggywiggy.com/33470/ye-koun-sa-audition-chal-raha-hai-hotel-me-https://chiggywiggy.com/vfile/33667/33788/1/6c2b6bdf2b094fc81a6a/1695124775/mp4/33667_1080p.mp4gi-hokar-nahate-boobs-dikhate-video-banwa-rahi-hai-sexy-girl-2-of-3/,https://chiggywiggy.com/vfile/33470/33524/1/51d3cb69fe660a48e2b8/1695124775/mp4/33470_480p.mp4,https://chiggywiggy.com/media/videos/tmb/000/033/470/2.jpg,ye koun sa audition chal raha hai hotel me https:,4:39
https://chiggywiggy.com/33780/unsatisfied-aunty-ka-masturbation-and-naked-body-show-online-mile-ladke-ne-aunty-ko-itna-horny-kar-diya-ki-aunty-ne-apne-ashlil-video-banaye-3-of-6/,https://chiggywiggy.com/vfile/33780/33928/2/da4d1b2c37fb81bd93d9/1695124775/mp4/33780_1080p.mp4,https://chiggywiggy.com/media/videos/tmb/000/033/780/1.jpg,unsatisfied aunty ka masturbation and naked body show online mile ladke ne aunty ko itna horny kar diya ki aunty ne apne ashlil video banaye 3 of 6,1:26
https://chiggywiggy.com/33368/hot-big-boobs-punjabi-girlfriend-recording-her-video-while-her-bf-kissing-and-fucking-her-in-hotel/,https://chiggywiggy.com/vfile/33368/33384/2/f8de3cd43845f135bdd3/1695124775/mp4/33368_720p.mp4,https://chiggywiggy.com/media/videos/tmb/000/033/368/1.jpg,hot big boobs punjabi girlfriend recording her video while her bf kissing and fucking her in hotel,7:01
https://chiggywiggy.com/31947/indian-teen-girlfriend-with-small-pussy-gets-fucked-while-her-parents-sleep/,https://chiggywiggy.com/vfile/31947/31578/1/12108d0788a5078326a0/1695124775/mp4/31947_1080p.mp4,https://chiggywiggy.com/media/videos/tmb/000/031/947/1.jpg,indian teen girlfriend with small pussy gets fucked while her parents sleep,5:55
https://chiggywiggy.com/32655/ye-kis-brand-ka-phone-hai-viral-meme-girl-video-big-boobs-chubby-girl-masturbating-on-live-cam-onlyfans-premium-leaked-video-matildem/,https://chiggywiggy.com/vfile/32655/32514/2/f3ef9e3b9b3db6b01e8e/1695124776/mp4/32655_720p.mp4,https://chiggywiggy.com/media/videos/tmb/000/032/655/1.jpg,ye kis brand ka phone hai viral meme girl video big boobs chubby girl masturbating on live cam onlyfans premium leaked video matildem,4:59
https://chiggywiggy.com/32151/nayi-shadi-ke-baad-office-me-busy-husband-ko-video-call-par-boobs-dikhati-aur-nipples-ko-thuk-lagake-ragadti-sexy-wife/,https://chiggywiggy.com/vfile/32151/31841/2/ddb31594640f7400d268/1695124776/mp4/32151_720p.mp4,https://chiggywiggy.com/media/videos/tmb/000/032/151/2.jpg,nayi shadi ke baad office me busy husband ko video call par boobs dikhati aur nipples ko thuk lagake ragadti sexy wife,0:53
https://chiggywiggy.com/32444/ghar-aaye-mama-ne-ki-shadishuda-banji-ki-mast-chudai-desi-homemade-sex-video-1-of-3/,https://chiggywiggy.com/vfile/32444/32218/2/c78e3711cdd9f1d4af58/1695124776/mp4/32444_480p.mp4,https://chiggywiggy.com/media/videos/tmb/000/032/444/6.jpg,ghar aaye mama ne ki shadishuda banji ki mast chudai desi homemade sex video 1 of 3,6:13
https://chiggywiggy.com/32255/chubby-girlfriend-ko-lund-chuswate-full-video-recording-desi-girlfriend-blowjob/,https://chiggywiggy.com/vfile/32255/31980/2/ff903fb45575ae2cc7b5/1695124776/mp4/32255_720p.mp4,https://chiggywiggy.com/media/videos/tmb/000/032/255/10.jpg,chubby girlfriend ko lund chuswate full video recording desi girlfriend blowjob,2:19
https://chiggywiggy.com/33882/sexy-wife-fucking-porn-mms-with-her-pervert-husband-indian-sex-video-free-desi-porn/,https://chiggywiggy.com/vfile/33882/34052/2/4936e2c8c39a2481f0ce/1695125139/mp4/33882_1080p.mp4,https://chiggywiggy.com/media/videos/tmb/000/033/882/5.jpg,sexy wife fucking porn mms with her pervert husband indian sex video free desi porn,9:46
https://chiggywiggy.com/32759/aged-chubby-wife-ka-hard-chudai-karte-full-homemade-sex-video-2-of-2/,https://chiggywiggy.com/vfile/32759/32631/1/4a0c38e6506f7a4fcaea/1695124776/mp4/32759_720p.mp4,https://chiggywiggy.com/media/videos/tmb/000/032/759/6.jpg,aged chubby wife ka hard chudai karte full homemade sex video 2 of 2,6:39
https://chiggywiggy.com/32042/sexy-figure-sri-lankan-girl-fucked-in-hotel-room/,https://chiggywiggy.com/vfile/32042/31696/2/8c47e7753ac9c7bd8675/1695124777/mp4/32042_720p.mp4,https://chiggywiggy.com/media/videos/tmb/000/032/042/3.jpg,sexy figure sri lankan girl fucked in hotel room,0:51
https://chiggywiggy.com/33896/yung-pinatigas-ka-lang-niya-pero-hindi-pinay-porn-video/,https://chiggywiggy.com/vfile/33896/34066/2/cf56fd996b4ac183a6b7/1695125134/mp4/33896_720p.mp4,https://chiggywiggy.com/media/videos/tmb/000/033/896/1.jpg,yung pinatigas ka lang niya pero hindi pinay porn video,3:57
https://chiggywiggy.com/32965/bhabhi-aap-pet-ke-bal-leti-aaj-piche-se-lene-ka-mood-hai/,https://chiggywiggy.com/vfile/32965/32884/1/960cb68f05a294e82c81/1695124777/mp4/32965_720p.mp4,https://chiggywiggy.com/media/videos/tmb/000/032/965/4.jpg,bhabhi aap pet ke bal leti aaj piche se lene ka mood hai,1:08
https://chiggywiggy.com/33165/lund-chuskar-leti-girlfriend-ke-choot-me-jaise-hi-land-ghusaya-chillane-lagi/,https://chiggywiggy.com/vfile/33165/33130/2/db325e82a91a14612447/1695124777/mp4/33165_720p.mp4,https://chiggywiggy.com/media/videos/tmb/000/033/165/1.jpg,lund chuskar leti girlfriend ke choot me jaise hi land ghusaya chillane lagi,2:10
https://chiggywiggy.com/32558/pet-ke-bal-leti-bhabhi-ke-upar-baith-ke-tej-shots-marta-lover-rough-anal-sex/,https://chiggywiggy.com/vfile/32558/32393/2/7a05b47912e00570c24c/1695124778/mp4/32558_1080p.mp4,https://chiggywiggy.com/media/videos/tmb/000/032/558/1.jpg,pet ke bal leti bhabhi ke upar baith ke tej shots marta lover rough anal sex,0:20
https://chiggywiggy.com/33666/itni-cute-girlfriend-mil-jaye-bas-cute-ladki-ka-live-nude-video/,https://chiggywiggy.com/vfile/33666/33786/2/b8dacb297fa40bca6ddd/1695124778/mp4/33666_1080p.mp4,https://chiggywiggy.com/media/videos/tmb/000/033/666/3.jpg,itni cute girlfriend mil jaye bas cute ladki ka live nude video,0:14
https://chiggywiggy.com/33275/store-room-me-videshi-workers-ka-quick-sex-kitne-chubby-aur-sexy-hai-ladki/,https://chiggywiggy.com/vfile/33275/33263/2/628282f658aada37954f/1695124778/mp4/33275_720p.mp4,https://chiggywiggy.com/media/videos/tmb/000/033/275/1.jpg,store room me videshi workers ka quick sex kitne chubby aur sexy hai ladki,1:31
https://chiggywiggy.com/32345/kitna-mast-body-aur-big-boobs-hai-bhabhi-ke-affair-me-pati-ke-best-friend-se-chudai/,https://chiggywiggy.com/vfile/32345/32089/1/be12e385a5d5ead06da7/1695124778/mp4/32345_480p.mp4,https://chiggywiggy.com/media/videos/tmb/000/032/345/7.jpg,kitna mast body aur big boobs hai bhabhi ke affair me pati ke best friend se chudai,1:59
https://chiggywiggy.com/33059/nahakar-towel-lapetkar-aayi-bhabhi-ne-towel-hatakar-apna-sexy-badan-dikha-diya/,https://chiggywiggy.com/vfile/33667/33788/1/6c2b6bdf2b094fc81a6a/1695124775/mp4/33667_1080p.mp4,https://chiggywiggy.com/media/videos/tmb/000/033/059/8.jpg,nahakar towel lapetkar aayi bhabhi ne towel hatakar apna sexy badan dikha diya,0:36
https://chiggywiggy.com/33350/malti-markam-rajkumari-muni/,https://chiggywiggy.com/vfile/33350/33361/1/810b61f697d9e4663a2d/1695124778/mp4/33350_1080p.mp4,https://chiggywiggy.com/media/videos/tmb/000/033/350/1.jpg,malti markam rajkumari muni,0:43
https://chiggywiggy.com/31946/cam-site-live-sex-girlfriend-getting-fucked-in-doggy-holding-her-long-hair/,https://chiggywiggy.com/vfile/31946/31575/2/b0345f147223e96171bc/1695124779/mp4/31946_1080p.mp4,https://chiggywiggy.com/media/videos/tmb/000/031/946/1.jpg,cam site live sex girlfriend getting fucked in doggy holding her long hair,2:20
https://chiggywiggy.com/33469/ye-koun-sa-audition-chal-raha-hai-hotel-me-https://chiggywiggy.com/vfile/33667/33788/1/6c2b6bdf2b094fc81a6a/1695124775/mp4/33667_1080p.mp4gi-hokar-nahate-boobs-dikhate-video-banwa-rahi-hai-sexy-girl-1-of-3/,https://chiggywiggy.com/vfile/33469/33523/2/0c040db5bad646113142/1695124779/mp4/33469_480p.mp4,https://chiggywiggy.com/media/videos/tmb/000/033/469/1.jpg,ye koun sa audition chal raha hai hotel me https:,5:00
https://chiggywiggy.com/32150/bahut-stiff-aur-mote-boobs-hai-is-girlfriend-ke-khule-me-ped-ke-niche-let-ke-chudai/,https://chiggywiggy.com/vfile/32150/31840/1/369a488e04d97fa522cf/1695124779/mp4/32150_720p.mp4,https://chiggywiggy.com/media/videos/tmb/000/032/150/6.jpg,bahut stiff aur mote boobs hai is girlfriend ke khule me ped ke niche let ke chudai,1:12
https://chiggywiggy.com/32654/beautiful-desi-wife-sucking-big-cock-while-watching-tv/,https://chiggywiggy.com/vfile/32654/32513/1/39347bae7628ec3f375b/1695124780/mp4/32654_720p.mp4,https://chiggywiggy.com/media/videos/tmb/000/032/654/1.jpg,beautiful desi wife sucking big cock while watching tv,2:04
https://chiggywiggy.com/33572/cute-tamil-girlfriend-kavitha-ko-hard-choda-bf-ne-naram-dudu-jhatko-se-hard-shake-ho-rahe-hai-1-of-2/,https://chiggywiggy.com/vfile/33572/33661/1/3926263582e0418af23b/1695124780/mp4/33572_720p.mp4,https://chiggywiggy.com/media/videos/tmb/000/033/572/5.jpg,cute tamil girlfriend kavitha ko hard choda bf ne naram dudu jhatko se hard shake ho rahe hai 1 of 2,1:42
https://chiggywiggy.com/32254/padosi-bhabhi-ki-daily-help-karta-tha-kush-hoke-chut-chodne-di-to-video-bana-raha-hai/,https://chiggywiggy.com/vfile/32254/31979/1/d0305eee8d83e744bf6d/1695124780/mp4/32254_720p.mp4,https://chiggywiggy.com/media/videos/tmb/000/032/254/5.jpg,padosi bhabhi ki daily help karta tha kush hoke chut chodne di to video bana raha hai,1:38
https://chiggywiggy.com/32443/ghar-aaye-mama-ne-ki-shadishuda-banji-ki-mast-chudai-desi-homemade-sex-video-2-of-3/,https://chiggywiggy.com/vfile/32443/32216/1/0837fa05047bec12e45e/1695124780/mp4/32443_480p.mp4,https://chiggywiggy.com/media/videos/tmb/000/032/443/5.jpg,ghar aaye mama ne ki shadishuda banji ki mast chudai desi homemade sex video 2 of 3,4:56
https://chiggywiggy.com/33779/unsatisfied-aunty-ka-masturbation-and-naked-body-show-online-mile-ladke-ne-aunty-ko-itna-horny-kar-diya-ki-aunty-ne-apne-ashlil-video-banaye-6-of-6/,https://chiggywiggy.com/vfile/33779/33926/1/3c7d79767e301ca55a2b/1695124781/mp4/33779_1080p.mp4,https://chiggywiggy.com/media/videos/tmb/000/033/779/1.jpg,unsatisfied aunty ka masturbation and naked body show online mile ladke ne aunty ko itna horny kar diya ki aunty ne apne ashlil video banaye 6 of 6,2:20
https://chiggywiggy.com/33468/raste-par-mili-sasti-randi-ko-room-par-lakar-gand-mara/,https://chiggywiggy.com/vfile/33667/33788/1/6c2b6bdf2b094fc81a6a/1695124775/mp4/33667_1080p.mp4,https://chiggywiggy.com/media/videos/tmb/000/033/468/8.jpg,raste par mili sasti randi ko room par lakar gand mara,14:42
https://chiggywiggy.com/33748/maaf-karna-riya-lekin-condom-lagake-maja-nahi-aata-karne-ka-meme-viral-video-mms-cute-gf-ke-boobs-kitna-der-bas-chus-hi-raha-hai-3-of-3/,https://chiggywiggy.com/vfile/33667/33788/1/6c2b6bdf2b094fc81a6a/1695124775/mp4/33667_1080p.mp4,https://chiggywiggy.com/media/videos/tmb/000/033/748/2.jpg,maaf karna riya lekin condom lagake maja nahi aata karne ka meme viral video mms cute gf ke boobs kitna der bas chus hi raha hai 3 of 3,2:57
https://chiggywiggy.com/32758/sexy-dehati-houswife-masturbation-in-bathroom-boobs-showing-and-tight-pussy-rubbing-for-horny-lover-3-of-3/,https://chiggywiggy.com/vfile/32758/32630/2/24a448322d7285328de3/1695124781/mp4/32758_720p.mp4,https://chiggywiggy.com/media/videos/tmb/000/032/758/1.jpg,sexy dehati houswife masturbation in bathroom boobs showing and tight pussy rubbing for horny lover 3 of 3,2:37
https://chiggywiggy.com/32963/madurai-wife-removed-her-black-bra-and-panty-showing-her-boobs-and-ass/,https://chiggywiggy.com/vfile/32963/32882/1/188765f474b0b3f20bd6/1695124781/mp4/32963_1080p.mp4,https://chiggywiggy.com/media/videos/tmb/000/032/963/4.jpg,madurai wife removed her black bra and panty showing her boobs and ass,1:33
https://chiggywiggy.com/33058/padosan-bhabhi-ko-bangle-par-kapde-sukate-pata-liya-pati-bahar-jate-hi-bhabhi-ki-mast-chudai/,https://chiggywiggy.com/vfile/33667/33788/1/6c2b6bdf2b094fc81a6a/1695124775/mp4/33667_1080p.mp4,https://chiggywiggy.com/media/videos/tmb/000/033/058/1.jpg,padosan bhabhi ko bangle par kapde sukate pata liya pati bahar jate hi bhabhi ki mast chudai,14:00
https://chiggywiggy.com/33274/boobs-aur-nipples-par-piercing-karayi-is-bhabhi-ko-dekho-kaise-naye-dildo-ka-pahli-baar-kaise-istemal-kar-rahi-hai/,https://chiggywiggy.com/vfile/33274/33262/1/724a093ab6006b73313b/1695124782/mp4/33274_720p.mp4,https://chiggywiggy.com/media/videos/tmb/000/033/274/1.jpg,boobs aur nipples par piercing karayi is bhabhi ko dekho kaise naye dildo ka pahli baar kaise istemal kar rahi hai,1:28
https://chiggywiggy.com/32344/desi-couple-ka-fantasy-roleplay-ankho-par-patty-band-ke-hard-chudai/,https://chiggywiggy.com/vfile/33667/33788/1/6c2b6bdf2b094fc81a6a/1695124775/mp4/33667_1080p.mp4,https://chiggywiggy.com/media/videos/tmb/000/032/344/1.jpg,desi couple ka fantasy roleplay ankho par patty band ke hard chudai,3:30
https://chiggywiggy.com/32653/cute-chashmish-girlfriend-sucking-cock-and-giving-boobs-job-to-her-bf-big-cock/,https://chiggywiggy.com/vfile/32653/32512/2/aa80334ec515348d33a0/1695124782/mp4/32653_720p.mp4,https://chiggywiggy.com/media/videos/tmb/000/032/653/1.jpg,cute chashmish girlfriend sucking cock and giving boobs job to her bf big cock,4:36
https://chiggywiggy.com/33164/bhabhi-pleases-her-devar-family-scandal-taboo-sex-pov-indian/,https://chiggywiggy.com/vfile/33164/33129/1/ffa01605313ed80f3a6c/1695124782/mp4/33164_720p.mp4,https://chiggywiggy.com/media/videos/tmb/000/033/164/1.jpg,bhabhi pleases her devar family scandal taboo sex pov indian,7:16
https://chiggywiggy.com/31945/chubby-chashmish-girlfriend-ki-panty-fad-ke-mota-lund-gusaya-chut-ka-pani-hard-chudai-se-nahi-nikla-to-pani-aane-tak-tej-chut-ragda/,https://chiggywiggy.com/vfile/31945/31572/1/a437fafd8ec446485c24/1695124782/mp4/31945_480p.mp4,https://chiggywiggy.com/media/videos/tmb/000/031/945/7.jpg,chubby chashmish girlfriend ki panty fad ke mota lund gusaya chut ka pani hard chudai se nahi nikla to pani aane tak tej chut ragda,7:51
https://chiggywiggy.com/33665/desi-high-demand-escort-full-nude-and-riding-on-client-cock-big-boobs-sexy-bitch-3-of-3/,https://chiggywiggy.com/vfile/33665/33784/1/e0a256d3bd28c0d1b424/1695124782/mp4/33665_480p.mp4,https://chiggywiggy.com/media/videos/tmb/000/033/665/1.jpg,desi high demand escort full nude and riding on client cock big boobs sexy bitch 3 of 3,0:49
https://chiggywiggy.com/32557/indian-village-bhabhi-big-boobs-sucking-and-fucking-at-night-indian-cheating-wife/,https://chiggywiggy.com/vfile/32557/32391/1/954a4cfb75d0fc312b76/1695124782/mp4/32557_1080p.mp4,https://chiggywiggy.com/media/videos/tmb/000/032/557/1.jpg,indian village bhabhi big boobs sucking and fucking at night indian cheating wife,2:20
https://chiggywiggy.com/33367/hay-ye-choot-ki-khujli-desi-college-girl-recording-her-masturbation-video-rubbing-her-tight-pussy-and-squeezing-her-big-boobs/,https://chiggywiggy.com/vfile/33367/33383/1/c6c8adeef32e50295684/1695124782/mp4/33367_720p.mp4,https://chiggywiggy.com/media/videos/tmb/000/033/367/8.jpg,hay ye choot ki khujli desi college girl recording her masturbation video rubbing her tight pussy and squeezing her big boobs,3:57
https://chiggywiggy.com/32442/sexy-figurewali-bhabhi-ki-tight-bhur-me-land-full-speed-me/,https://chiggywiggy.com/vfile/32442/32215/2/8d90ca13330fc8bd0f7c/1695124785/mp4/32442_1080p.mp4,https://chiggywiggy.com/media/videos/tmb/000/032/442/1.jpg,sexy figurewali bhabhi ki tight bhur me land full speed me,0:44
https://chiggywiggy.com/32253/cute-girlfriend-playing-with-tight-cock-shaking-it-and-rubbing-it-on-her-pussy/,https://chiggywiggy.com/vfile/32253/31978/2/37ab1b0b5d8769d0d5d3/1695124782/mp4/32253_720p.mp4,https://chiggywiggy.com/media/videos/tmb/000/032/253/5.jpg,cute girlfriend playing with tight cock shaking it and rubbing it on her pussy,0:33
https://chiggywiggy.com/32041/nahane-se-pahle-bathroom-me-boobs-dabate-aur-show-karte-video-call-par-dikhaya-viral-girl/,https://chiggywiggy.com/vfile/32041/31695/1/ad3e53956d95c8027aad/1695124782/mp4/32041_720p.mp4,https://chiggywiggy.com/media/videos/tmb/000/032/041/1.jpg,nahane se pahle bathroom me boobs dabate aur show karte video call par dikhaya viral girl,0:55
https://chiggywiggy.com/33571/meri-college-ki-girlfriend-ki-tight-choot-aur-boobs-dekh-lo-guys-1-of-2/,https://chiggywiggy.com/vfile/33667/33788/1/6c2b6bdf2b094fc81a6a/1695124775/mp4/33667_1080p.mp4,https://chiggywiggy.com/media/videos/tmb/000/033/571/6.jpg,meri college ki girlfriend ki tight choot aur boobs dekh lo guys 1 of 2,2:34
https://chiggywiggy.com/33778/bulati-hai-magar-jaane-ka-nahi-meme-viral-video-mms/,https://chiggywiggy.com/vfile/33778/33924/2/9ac0cf61abb28d46c649/1695124785/mp4/33778_480p.mp4,https://chiggywiggy.com/media/videos/tmb/000/033/778/1.jpg,bulati hai magar jaane ka nahi meme viral video mms,14:59
https://chiggywiggy.com/33467/very-young-girl-and-hot-boy-fuking-well-very-much-enjoy-cute-sexy-college-girl-fuck-with-her-partner-beautiful-ass-cute-sexy-tight-pussy-two-boys-two-/,https://chiggywiggy.com/vfile/33667/33788/1/6c2b6bdf2b094fc81a6a/1695124775/mp4/33667_1080p.mp4,https://chiggywiggy.com/media/videos/tmb/000/033/467/1.jpg,very young girl and hot boy fuking well very much enjoy cute sexy college girl fuck with her partner beautiful ass cute sexy tight pussy two boys two ,8:05
https://chiggywiggy.com/32757/sexy-dehati-houswife-masturbation-in-bathroom-boobs-showing-and-tight-pussy-rubbing-for-horny-lover-2-of-3/,https://chiggywiggy.com/vfile/32757/32629/1/d685234747c6332a465e/1695124786/mp4/32757_720p.mp4,https://chiggywiggy.com/media/videos/tmb/000/032/757/8.jpg,sexy dehati houswife masturbation in bathroom boobs showing and tight pussy rubbing for horny lover 2 of 3,2:48
https://chiggywiggy.com/33057/badi-didi-ne-chote-bhai-ko-chodna-sikhaya-akele-me-didi-ne-bhai-se-chudwaya-1-of-2/,https://chiggywiggy.com/vfile/33667/33788/1/6c2b6bdf2b094fc81a6a/1695124775/mp4/33667_1080p.mp4,https://chiggywiggy.com/media/videos/tmb/000/033/057/1.jpg,badi didi ne chote bhai ko chodna sikhaya akele me didi ne bhai se chudwaya 1 of 2,3:05
https://chiggywiggy.com/32962/tamil-girlfriend-tight-pussy-fucked-by-lover/,https://chiggywiggy.com/vfile/32962/32880/2/6247ab5525e9c91c8016/1695124787/mp4/32962_1080p.mp4,https://chiggywiggy.com/media/videos/tmb/000/032/962/2.jpg,tamil girlfriend tight pussy fucked by lover,2:08
https://chiggywiggy.com/32343/dehati-bhabhi-ke-gand-me-thuk-ke-lund-gussaya-chouda-kar-abh-gand-dono-haatho-se-sexy-moaning/,https://chiggywiggy.com/vfile/33667/33788/1/6c2b6bdf2b094fc81a6a/1695124775/mp4/33667_1080p.mp4,https://chiggywiggy.com/media/videos/tmb/000/032/343/1.jpg,dehati bhabhi ke gand me thuk ke lund gussaya chouda kar abh gand dono haatho se sexy moaning,2:51
https://chiggywiggy.com/33273/ye-to-lambe-baigan-se-aaj-choot-hi-faad-legi-kitne-tej-choot-ragad-rahi-hai/,https://chiggywiggy.com/vfile/33273/33261/2/c64bf68979fc065ab693/1695124788/mp4/33273_720p.mp4,https://chiggywiggy.com/media/videos/tmb/000/033/273/2.jpg,ye to lambe baigan se aaj choot hi faad legi kitne tej choot ragad rahi hai,1:25
https://chiggywiggy.com/32556/building-ka-steps-koi-istemal-nahi-karta-usi-baat-ka-faida-utakar-shant-sidiyo-par-bf-ne-girlfriend-ko-khade-khade-choda/,https://chiggywiggy.com/vfile/32556/32389/2/cefaf1925d8b8ab7c2a2/1695124789/mp4/32556_1080p.mp4,https://chiggywiggy.com/media/videos/tmb/000/032/556/1.jpg,building ka steps koi istemal nahi karta usi baat ka faida utakar shant sidiyo par bf ne girlfriend ko khade khade choda,2:23
https://chiggywiggy.com/32652/bhabhi-ke-sath-threesome-karte-gand-marne-ki-taiyari-bhabhi-keh-rahi-hai-mujse-nahi-hoga/,https://chiggywiggy.com/vfile/32652/32511/1/9e8286944425da2d4af0/1695124789/mp4/32652_720p.mp4,https://chiggywiggy.com/media/videos/tmb/000/032/652/1.jpg,bhabhi ke sath threesome karte gand marne ki taiyari bhabhi keh rahi hai mujse nahi hoga,2:10
https://chiggywiggy.com/33366/hot-college-girl-ko-uncle-ne-ghodi-banake-choda/,https://chiggywiggy.com/vfile/33366/33382/2/f5d3c5050ae7708c6d7d/1695124789/mp4/33366_720p.mp4,https://chiggywiggy.com/media/videos/tmb/000/033/366/1.jpg,hot college girl ko uncle ne ghodi banake choda,1:55
https://chiggywiggy.com/33466/choot-ki-khujli-se-pareshan-girlfriend-ungali-dal-dal-ke-ragad-rahi-hai-aur-kitni-gusse-me-lag-rahi-hai/,https://chiggywiggy.com/vfile/33667/33788/1/6c2b6bdf2b094fc81a6a/1695124775/mp4/33667_1080p.mp4,https://chiggywiggy.com/media/videos/tmb/000/033/466/1.jpg,choot ki khujli se pareshan girlfriend ungali dal dal ke ragad rahi hai aur kitni gusse me lag rahi hai,1:31
https://chiggywiggy.com/32252/patli-girlfriend-ki-reserve-cowgirl-pose-me-hard-jumps-lambe-lund-par/,https://chiggywiggy.com/vfile/32252/31977/1/c8398109d1888ee01280/1695124789/mp4/32252_720p.mp4,https://chiggywiggy.com/media/videos/tmb/000/032/252/5.jpg,patli girlfriend ki reserve cowgirl pose me hard jumps lambe lund par,1:38
https://chiggywiggy.com/33664/desi-high-demand-escort-full-nude-and-riding-on-client-cock-big-boobs-sexy-bitch-2-of-3/,https://chiggywiggy.com/vfile/33664/33783/2/2a415d17c5365be7a2a4/1695124789/mp4/33664_480p.mp4,https://chiggywiggy.com/media/videos/tmb/000/033/664/10.jpg,desi high demand escort full nude and riding on client cock big boobs sexy bitch 2 of 3,1:15
https://chiggywiggy.com/32040/sexy-nepali-ladki-apne-mote-boobs-dikhakar-chute-me-ungali-karte-video-bana-rahi-hai-bf-ke-liye/,https://chiggywiggy.com/vfile/32040/31694/2/019a1e82090904ec4c5a/1695124789/mp4/32040_720p.mp4,https://chiggywiggy.com/media/videos/tmb/000/032/040/1.jpg,sexy nepali ladki apne mote boobs dikhakar chute me ungali karte video bana rahi hai bf ke liye,2:45
https://chiggywiggy.com/31944/delhi-aiims-mallu-nurse-girl-fingering-and-recording-her-masturbation-video/,https://chiggywiggy.com/vfile/31944/31571/2/7ba04da83c97ccbf92c6/1695124789/mp4/31944_480p.mp4,https://chiggywiggy.com/media/videos/tmb/000/031/944/1.jpg,delhi aiims mallu nurse girl fingering and recording her masturbation video,1:59
